ISO3	update	lat	lng	Country	quarantines	travel_Bans	schools_closure	public_events_cancel	Health	Overall_fiscal_measures	Fiscal_people	Fiscal_firm	Monetary_Prudential
CZE	30-Mar-2020	49.848	14.717	Czech Republic	From 16 March to April 1st the free movement of people within the country is banned, with some exceptions (travel to work, medical facilities, family and other necessary trips). <Br/>On March 12, the Government declared a state of emergency for 30 days.                                                                                                                                             As of 13 March all citizens and foreigners with residence travelling from risk areas have to automatically undergo a 14-day quarantine upon their return to the Czech Republic                                                                                                                                      As of 19 March, all persons need to be equipped with a face mask or other covering of nose and mouth while outside of their residence.<Br/>As of 25 March maximum of two persons can stay together at publicly accessible places in order to protect public health (exceptions to family members, job related activities etc.). 	All foreigners without residence are prohibited from entering the country and citizens and foreigners with a residence are prohibited from leaving the country (except for cross-border workers, who have a special regime). (from March 16)	All primary, secondary schools and higher education institutions are closed from 13 March until further notice.                                                                                   State school leaving examination and the uniform secondary schools entrance examinations postponed until after the end of the ban on school attendance.	From 14 March 2020 to April 1st, all stores are closed except for grocery stores, pharmacies, sellers of sanitary goods, medical devices and fuels and sales via the Internet and other remote stores.                                     The public is also banned from entering entertainment, sports and wellness premises, music and social clubs, galleries and libraries (until further notice).                                                                                                                                                                         Accommodation providers and restaurants are banned from operation until 1 April. As of 27 March, accommodation services are allowed to accommodate guests, who need to be accommodated for the purposes of work or business.<Br/>All public authorities and administrations instructed to switch to limited operations until 1st April.	From 16 March 2020, the government has banned all doctors, dentists, pharmacists and medical staff from taking their leave during the emergency.<Br/><Br/>- The Ministry of Finance announced on March 4 that it would start regulating prices of protective respiratory masks (FFP3 class) and prohibited exporting the masks and their sale to the general public.                          <Br/>* All acute inpatient care facilities have been ordered to allocate maximum possible bed capacity to COVID-19 patients, including the provision of necessary staff and appropriate safety conditions. Visits of relatives in hospitals have been prohibited (except for visiting children, etc.). Medical students in their last two years of studies and students in the last two years of nursing schools were called to assist in the provision of health services. Exports of drugs from the Czech Republic has been prohibited. Planned surgeries that can be delayed were ordered to be postponed.	A revised budget bill was passed on March 25 for a budget balance to go from a planned deficit of CZK 40 bn to a deficit of CZK 200 bn (difference of CZK 160 bn). Debt to GDP is projected to increase from 29.1% in 2019 to 33.2% in 2020. according to the MoF.	The government has approved financial contributions for the self-employed and employees currently at home to ensure childcare as compensation for loss of earnings (due to schools closure). The state will pay CZK 424 per day (up to 31 days, maximum roughly EUR 500) to all self-employed persons and 60% of reduced assessment base to employees for taking care of children aged 6 to 13 (on condition that a second member of the family no longer receives the care allowance).<Br/>Self-employed will be given a six-month waiver on the (minimum) payments of health and social insurance (May to August). <Br/>The government has also approved a targeted employment support programme (Antivirus), to compensate for all or part of salary costs for the time of the quarantine or emergency measures (from 1st March). Employees ordered into quarantine will receive 60 % of their salaries and the government will reimburse the company in full. Employers, who had to close or reduce operations because of the crisis measures, will pay employees their full salaries, and the state will reimburse employers 80 % of the costs. Employees in firms facing inputs supply issues or drop in sales will receive 80%, resp. 60%, of their salaries with the state reimbursing 50% of the cost in both cases. The Ministry of Labour and Social Affairs expects the total costs of the Program to be 1.2bn. CZK (0.02 % of GDP).<Br/>Other proposed measures include: Waiver of the advance payments (not the tax itself) for corporate and personal income tax in June. Introduction of the institute of tax return retroactivity <Br/>- entrepreneurs will be able to recover any loss reported in 2020 in their tax bases in 2019 and 2018, thereby obtaining a refund from the Financial Administration.<Br/>The Government released 3.3 billion CZK for the 2020 Rural Development Program. This funding should help entrepreneurs in agriculture, food and forestry while fighting coronavirus crisis. The main reason for this support is ensuring the Czech food independency. The government has introduced waivers of any penalties and default interest for corporate and personal income tax payments up to 1 July.<Br/><Br/><Br/>	The government introduced the COVID I loan program for SMEs in the total amount of CZK 5bn (about 180m EUR, 0.1% of GDP). SMEs will be able to apply for a direct interest-free loan in the range of CZK 0.5 to 15m. Loans are granted up to 90% of eligible expenditure with a maturity of 2 years including the possibility of deferred repayment for up to 12 months.<Br/>To accomodate high demand for loans under COVID I the government has further approved COVID II program with another 5bn CZK allocation in the form of guarantees for loans (CZK 10k to 15m) from commercial banks (with annual deferral of repayments), where the Czech-Moravian Guarantee and Development Bank will be subsidising the interest rate. The leverage effect is expeted to facilitate distribution of up to 30bn among the programme participants.<Br/>The government has also approved a targeted employment support programme (Antivirus), to compensate for all or part of salary costs for the time of the quarantine or emergency measures (from 1st March). Employees ordered into quarantine will receive 60 % of their salaries and the government will reimburse the company in full. Employers, who had to close or reduce operations because of the crisis measures, will pay employees their full salaries, and the state will reimburse employers 80 % of the costs. Employees in firms facing inputs supply issues or drop in sales will receive 80%, resp. 60%, of their salaries with the state reimbursing 50% of the cost in both cases. The Ministry of Labour and Social Affairs expects the total costs of the Program to be 1.2bn. CZK (0.02 % of GDP).<Br/>Other proposed measures include: Waiver of the advance payments (not the tax itself) for corporate and personal income tax in June. Introduction of the institute of tax return retroactivity <Br/>- entrepreneurs will be able to recover any loss reported in 2020 in their tax bases in 2019 and 2018, thereby obtaining a refund from the Financial Administration. The government has introduced waivers of any penalties and default interest for corporate and personal income tax payments up to 1 July. Waiver of penalties related to late VAT declarations.<Br/>It will also postpone the launch of the final phase of Electronic Sales Control System (EET) until 3 months after the end of the State of emergency.<Br/><Br/><Br/><Br/>	The Czech National Bank (CNB) Board unanimously lowered the policy rate by 75bp on March 26 to 1.00% at its regular monetary policy meeting. This follows a 50bp cut from ten days previously.<Br/><Br/>The CNB expects the covid outbreak to lead to a strong recession that will last throughout the year. In its forward guidance the central bank stated that further measures could include rate cuts, liquidity support, interventions to stabilise the FX and launching QE.<Br/><Br/>The CNB Board has also lowered the countercyclical capital buffer rate to 1.00% with effect from 1 April 2020 (from a current level of 1.75%. Otherwise, the banking system is judged stable and well capitalised, able to withstand adverse developments.                                                                                                                                                          <Br/>                                                                                                                                                                                                                                                         <Br/>- On 16 March 2020, the Czech National Bank cut the main policy rate by 50 basis points, to 1.75%.<Br/><Br/>- The Board declared that it was ready to cut interest rates further should this be warranted by economic developments. It announced that it stood ready to intervene in the foreign exchange market to prevent excessive volatility of the koruna (in line with the managed float).<Br/><Br/>- While the Board does not detect a shortage of liquidity in the banking sector, it will from now on conduct its liquidity-providing repo operations three times a week instead of once a week, with no spread over the policy rate (previously 10bps). <Br/><Br/>- The Board also revised its earlier decision to increase the countercyclical capital buffer rate to 2% with effect from 1 July 2020. This step will now not happen, and banks will continue to maintain the current buffer at 1.75%. The Board will closely observe the situation, and stands ready to reduce the buffer to 0%, if deemed necessary	
DEU	30-Mar-2020	51.394	9.657	Germany	Contact ban for meetings of more than two individuals in public with exemption for household members have been decided on March 22 across the country for at least 14 days. Bavaria has initiated a lockdown for the state on March 21 for 14 days which allows going out only for necessary reasons and with members of the own household. Sachsen and Saarland have implemented such a lockdown starting on March 23 for 14 days.	Reintroduction of border controls at the internal Schengen borders to France, Luxembourg, Switzerland, Denmark, Italia, Spain and Austria with restriction on entry since 16/19 March. Goods and commuters are allowed to cross border. Travel warning for all countries in place until the end of April. In accordance with the decision at the European level, individuals from outside the EU with few exceptions cannot enter the country for at least 30 days starting March 18.	Most schools and day care centres closed until mid April.	Restaurants are now closed. Non-essential stores, leisure and cultural facilities have been closed since March 15/16. Larger events were cancelled already earlier.                                     <Br/>	The budget committee provided additional 800 million for protective equipment, equipment for intensive care and research on vaccines. Previously, around &euro; 350 million were already agreed on for protective equipment and the WHO. Agreement of federal level and L&auml;nder to expand hospital capacities for COVID by e.g. postponing elective treatments. Additional funding for hospitals will be provided to balance losses due to rescheduled surgeries and to increase ICU capacity. Federal government will provide EUR 2.8 billion in 2020, additional funding will come from health insurance. Additional central procurement of special equipment on federal level, in addition to procurement of hospitals and private practices <Br/>- participation in EU joint procurement. Derogation for the provision and use of biocidal products (Biocide Ordinance) allows pharmacists to produce and place on the market hand disinfectants. Insurance Physicians: Sick leave by telephone for up to 14 days for patients with minor illnesses.	- Overall fiscal measures and funds made available to slow further spreading of the virus, ensure best-possible medical care and protect the economy amount to well over EUR 1 trillion (including the additional EUR 156 billion from the supplementary budget 2020).<Br/><Br/>- Coalition parties agreed on an additional investment package of &euro; 3.1 billion per year over the period 2021 <Br/>- 2024 funded by the 2019 budget surplus.<Br/>	Starting April 1, access to social benefits (Basic income support for job-seekers under Book II of the Social Code (SGB II) and Social assistance under Book XII of the Social Code (SGB XII)) will be eased for six months, with assets and apartment size not taken into consideration. Parents, who temporarily lose income, will be able to benefit from child allowance (Kinderzuschlag).	- Short-time working schemes: The "short-time" work scheme will be easier to access temporarily as was the case during the financial crisis. Firms will be able to request support for their workers under this scheme if 10% of their workforce are affected by cuts in working hours as opposed to one third under the usual regulation. In addition to compensating 60% of the difference in monthly net earnings due to reduced hours, the labour agency will now also cover 100% of social-security contributions for the lost work hours. This is an increase compared to the financial crisis, where only 50% of social-security contributions were subsidised and employers had to cover the other half. <Br/><Br/>- Providing liquidity to affected firms through programs of the KfW with unlimited credit. Firm size limitations for liquidity support will be adjusted upwards. Risk taken by the government will increase. The volume of guarantees provided by guarantee banks will be doubled to &euro;2.5 billion. <Br/><Br/>- Direct support to self-employed and small businesses with fewer than 10 employees of up to EUR 15 000 per firm (total of EUR 50 billion foreseen). <Br/><Br/>- An economic stabilisation fund for larger companies with 250 employees or more. The fund will provide EUR 100 billion for recapitalisation, EUR 400 billion of guarantees for corporate liabilities, and a credit authorisation for EUR 100 billion to the KfW for refinancing purposes.<Br/><Br/>- Tax deferrals are possible and tax prepayments can be adapted to expected lower income in 2020. Enforcement measures and penalty surcharges will be paused in 2020 if the enterprise is hit hard. For companies that find themselves in financial difficulties as a result of the current situation, the obligation to file for insolvency will be suspended until September 30, 2020.<Br/>	The national designated authority BaFin declared its intention to reduce the countercyclical capital buffer from 0.25 % to 0 % as of 1 April 2020.	
DNK	30-Mar-2020	56.113	9.096	Denmark	People returning from abroad are strongly encouraged to self-quarantine for two weeks.	- Borders are closed to non-citizens with no critical reason to enter (e.g. work or visit sick family member). EU border restrictions apply as well.<Br/><Br/>- Air traffic is de facto shut down. <Br/><Br/>- Restrictions have been imposed on the number of passengers in public transport and capacity has been increased.	All schools, childcare and education facilities are closed until13 April.	- Gatherings of more than 10 people are banned (inside as well as outside). Does not apply in work places. <Br/><Br/>- Only food stores, pharmacies and stores allowing sufficient physical distance are allowed to remain open. All restaurants, bars and clubs are closed (except for take-away). Personal services not allowing sufficient physical distance are required to close (e.g. hairdressers).	- The number of ICU spots is being increased as much as possible and nurses are receiving training to work in ICU. Currently 1 060 ICU spots with ventilators have been freed for patients with COVID-19 (18 per 100 000 population).<Br/><Br/>- The health sector has postponed treatment of all non-critical issues.<Br/><Br/>- Retired health staff, students and others with relevant training are encouraged to offer their help if needs arise. <Br/><Br/>- Legislation has been passed to allow the health sector to focus on critically ill people only and use forced isolation and forced vaccination if needed.	- Four economic packages have been passed to provide direct cash support to workers and firms as well as increase access to liquidity. Combined fiscal support amounts to around 2.8% of GDP with additional 10% of GDP in liquidity measures and government guarantees (off-balance sheet). The government has committed to provide the needed resources to the health sector (amount not quantified).<Br/><Br/>- Investments by municipalities are being frontloaded to support economic activity and budget ceilings are temporarily suspended (DKK 2.5 billion).	- Support to self-employed: Self-employed and freelancers experiencing a drop in turnover of more than 30% can get cash support amounting to 75% of the loss (max EUR 3 100 per month). The scheme runs for three months (expected cost DKK 10 billion).<Br/><Br/>- Support to unemployed: For workers in unemployment or on sick leave benefits, the remaining entitlement period will be frozen for three months and all job search and activation requirements are cancelled. <Br/><Br/>- For students, that often have a part-time job in most affected sectors, the limit on the student loan facility has been increased (DKK 1.5 billion).	- Cash support to firms: Firms with a drop in turnover of more than 40% can get cash support to cover part of their fixed costs (up to 80%), full compensation of fixed costs are provided to firms forced to temporarily close due to the containment measures. The scheme runs for three months (expected cost DKK 40 billion).<Br/><Br/>- Support to employees at risk of layoff: A tripartite agreement on wage subsidies was reached with social partners on 15 March. For firms experiencing large falls in demand and at risk of laying off 30% of workers (or minimum 50 people), the employees can be sent home and the government will cover 75% of the salary (maximum EUR 3 100), if the firm promises not to lay off any workers for economic reasons. Firms will also have to cover the remaining 25% to ensure employees can keep their full salary. For hourly workers the compensation rate is 90% (maximum EUR 3500). The scheme is so far available for three months (expected fiscal costs DKK 2.6 billion).<Br/><Br/>- An existing short-time work scheme is also available and has been made more flexible and allocated more resources (DKK 1.7 billion).<Br/><Br/>- Sick leave benefits for people with COVID-19 will be fully covered by the government. Normally, employers pay the first 30 days of sick leave and self-employed have a two-week waiting period. Both are suspended (DKK 1.7 billion).<Br/><Br/>- Compensation is provided to organisers of events that are cancelled due to the ban on large public gatherings (DKK 100 million).<Br/><Br/><Br/>- VAT and income tax payments have been deferred and is expected to boost liquidity by DKK 165 billion in total, of which DKK 40 billion are targeted SMEs. One of the preliminary payments of corporate income tax was due on 20 March 2020. The prepayment is based on the expected profits made in 2020. If the spreading of coronavirus is affecting the business in question, it is possible to reduce the expected profits for 2020 and consequently reduce the preliminary payment of tax.<Br/><Br/>- Local governments will frontload payments to firms and defer charging tax on business properties (DKK 7.6 billion).<Br/><Br/>- Two government loan guarantee schemes have been set up, one for large firms (market-based) and one for SMEs (DKK 5.4 billion resources reserved for expected losses). <Br/><Br/>- State guarantees to the travel industry (Travel Guarantee Fund) has been increased by DKK 1.5 billion and the scope is increased to also cover companies' costs associated with refunds due to cancellations related to the coronavirus.<Br/><Br/>- Access to export credit for SMEs has been increased (DKK 1.3 billion in total).<Br/><Br/>- A government guarantee is provided to SAS airlines of DKK 1 billion (Sweden and Norway providing similar amounts).	- The policy interest rate was increased by 15 bps to -0.6% (20 March). This unusual move reflects the sole objective of the monetary policy to maintain the peg to the euro. Since October the exchange rate has gradually weakened, which intensified with the recent financial turmoil. With the increase the (negative) spread to the euro area has narrowed from 25 bps to 10 bps. <Br/><Br/>- The countercyclical capital buffer has been released (down to zero from 1%, it was due to increase to 1.5% by June and to 2% by December). <Br/><Br/>- An extraordinary lending facility has been established, allowing banks to borrow at -0.35% (1-week and 3-months loans) instead of the regular rate of 0.05%.<Br/><Br/>- Swap lines with the ECB and Federal Reserve have been agreed to ensure sufficient euro and US dollar liquidity to banks. <Br/><Br/>- A joint statement by the government and the financial sector commits banks and mortgage banks to support firms and households with additional loans and payment holidays.	
