ISO3	update	lat	lng	Country	quarantines	travel_Bans	schools_closure	public_events_cancel	Health	Overall_fiscal_measures	Fiscal_people	Fiscal_firm	Monetary_Prudential
IND	30-Mar-2020	22.741	78.236	India	Mid-March: Compulsory home quarantine to all people with recent travel history and people arriving in India from COVID-19 affected areas for a minimum period of 14 days. Additionally, if any person has come in contact with a COVID-19 patient, either by sharing the same household, same environment or by direct touch, he or she was also advised to home quarantine themselves for a period of 14 days.  With this, the central government has also issued a set of guidelines with instructions for home quarantine.<Br/>As on March 21, 64,000 persons have arrived from other countries, out of which 8,000 have been put in various quarantine facilities and 56,000 are in home isolation. <Br/>On March 24, the Prime Minister announced a 3 weeks nation-wide lockdown starting March 25th to ensure that people stay at home and do not access public spaces so as to contain the spread of COVID-19. <Br/>	Mid-March: Suspension of all visas, except for a few categories. <Br/>March 21: A temporary ban for a week on international flights landing in the country for a week. <Br/>March 25: Ban on international arrivals and passenger flights on all domestic routes. The country's rail network suspended most passenger services. All public transport services for roadways also suspended till April 15th .  <Br/>March 26: Extended ban on all international flights till April 15th, excluding approved all-cargo operations and flights. <Br/>So far, over 1.5 million passengers have been screened at airports under Universal Health Screening Practice. <Br/>	March 5th: Schools closed in some of the municipalities and states, including Delhi till end of March.   <Br/>March 20: All educational institutions in almost all states closed for all teaching staffs as well as non-teaching staff till March 31st. <Br/>March 25: Following nation-wide lockdown since March 25, all the educational institutions will remain completely closed for the period of 21 days ie. till April 15th. <Br/>	March 12: Partial shutdowns was imposed on educational institutions, stadiums, cinema halls, and sports clubs and gathering of people (including social, political, cultural, religious and family events) were banned in some of the states, including Delhi.  <Br/>Since March 25th, following nation-wide lockdown, all places of worship are closed for the public, no religious congregation is permitted, all social / political / sports / entertainment / academic / cultural / religious function / gathering have been prohibited across the country. In case of funerals, congregation of not more than twenty persons is being permitted. <Br/>	Early March, the government introduced export restrictions on 26 pharma products (active pharma ingredients and formulations, including paracetamol) to keep domestic supplies steady.   <Br/><Br/>March 19: Hospitals have been asked to defer elective surgeries. The government capped the price of sanitizer bottles and banned exports of masks, ventilator machines and also textiles used to make masks. <Br/><Br/>March 24: An emergency health fund of INR 150 billion (USD 2 billion) for treating COVID-19 patients and strengthening the medical infrastructure of the country including for rapidly ramping up the number of testing facilities, Personal Protective Equipment (PPE), Isolation Beds, ICU beds, Ventilators and other essential equipment announced. Simultaneously, training of medical and paramedical manpower will also be undertaken.Cumulatively 187,904 persons are under surveillance, and around 35,073 have completed 28 days observation period as on day. Of the total samples tested (12872), 2023 samples have been tested by NCDC of which, 52 have tested positive for COVID-19. States such as Gujarat, Assam, Jharkhand, Rajasthan, Goa, Karnataka, MP and J&K are setting up hospitals dedicated for the management of COVID-19. 118 laboratories have been included in the ICMR network of COVID-19 testing with a capacity to test 12,000 samples per day. In the last five days (March 20-24), on an average 1338 samples have been tested per day. Furthermore, 22 private lab chains have registered with ICMR (till 24th March 2020) for COVID-19 testing. They have 15,500 collection centers nationwide. <Br/><Br/>	March 19: A COVID-19 task force under the guidance of Finance Minister of India was set up to design financial packages to deal with the impact of Corona virus on the individual lives and livelihoods as well as on the economy as a whole. <Br/><Br/>On March 26, the central government a INR 1.7 trillion rupees (USD 23 billion) aimed at ensuring that families belonging to poor and lower to middle income groups are able to carry out their daily lives smoothly under the lockdown.<Br/> 	The central government package announced on March 26 largely focus on people, targeting low<Br/>- and middle-income groups. Major provisions in the package includes :<Br/><Br/>- Insurance cover of INR 5 million per health worker fighting COVID-19 to be provided under Insurance Scheme<Br/><Br/>- 800 million poor people will to get 5 kg wheat or rice and 1 kg of preferred pulses for free every month for the next three months<Br/><Br/>- 200 million women Jan Dhan account holders to get INR 500 per month for next three months<Br/><Br/>- Increase in wage for workers engaged in the rural public employment programme (MNREGA) to INR 202 a day from INR 182 to benefit 136.2 million families<Br/><Br/>- An ex-gratia of INR 1,000 to 30 million poor senior citizen, poor widows and poor disabled<Br/><Br/>- Government to front-load INR 2,000 paid to farmers in first week of April under existing PM Kisan Yojana to benefit 87 million farmers<Br/><Br/>- Central Government has given orders to State Governments to use Building and Construction Workers Welfare Fund to provide relief to Construction Workers<Br/><Br/>Before March 26, some states and cities had introduced measures. As an example, the state government of Bihar announced it will bear the entire expenses incurred on the treatment of the coronavirus patients and will pay a compensation for family in the case of death due tocoronavirus.  Union Territory of Delhi announced (March 20) that pensions for the elderly and widows will be doubled, food will be provided for the homeless, 7.5 kg free ration will be provided to 7.2 million beneficiaries. Kerala introduced a INR 200 billion package largely focused on people, including INR 5 billion health package; 2 month welfare pension, INR 20 billion each for loans and emplotment guarantee programme ; direct handout for substistence for families not eligible for welfare pensions; free food grains through ration shops  for needy families etc. 	March 24: The deadline for filing returns of goods and services tax for March, April and May has been extended till June 30. For companies with less than INR 50 million turnover, no interest, penalty and late fee to be charged on late GST return filing. For companies with turnover of over INR 50 million, no late fee and penalty will be charged on late GST return filing; interest rate was reduced to 9%. <Br/><Br/>March 26: Government to pay Employee Provident Fund contributions of both employee and employer for the next three months, for all those establishments which have up to with 100 employees, 90% of whom earn less than INR 15,000 a month. <Br/>	Reduction in the policy repo rate of 75 basis points on March 27;<Br/><Br/>Accommodative stance of monetary policy as long as necessary to revive growth, while keeping inflation within the target.<Br/><Br/>Two USD buy/sell swap auction of USD 5 billion each conducted on March 26 and April 23, 2019, injecting liquidity into the banking system amounting to INR 345.6 billion and INR 348.7 billion, respectively.<Br/><Br/>Seven open market purchases, injecting INR 9.250 billion into the system.<Br/><Br/>Four simultaneous purchase and sale of government securities under Open Market Operations (special OMOs or what is known as operation twist) during December and January (December 23 and 30, 2019 and January 6 and 23, 2020) to ensure better monetary policy transmission.<Br/><Br/>Five long term repo operations (LTROs) between February 17 and March 18, 2020 for one-year and three-year tenors amounting to INR 1,25 trillion of durable liquidity at reasonable cost (fixed repo rate).<Br/><Br/>Exemption on incremental credit disbursed by banks between January 31 <Br/>- July 31, 2020 on retail loans for automobiles, residential housing and loans to micro, small and medium enterprises (MSMEs) from the maintenance of cash reserve ratio (CRR).<Br/><Br/>Two 6-month US Dollar sell/buy swap auction providing dollar liquidity amounting to USD 2.71 billion.<Br/><Br/>Fine-tuning variable rate repo auctions of INR 500 billion and INR 250 billion of 8 days and 3 days maturity on March 26 and March 31, respectively, with standalone primary dealers (SPDs) allowed to participate.<Br/><Br/>Fine-tuning variable rate Repo auctions of 16-day maturity amounting to INR 777.45 billion on March 23-24, 2020.<Br/><Br/>The amount under the Standing Liquidity Facility (SLF) available for standalone primary dealers was enhanced from INR 28 billion to INR 10 billion on March 24, 2020 and this will be available till April 17, 2020.	
IRL	30-Mar-2020	53.214	-7.588	Ireland	Unavailable information	There are no entry restrictions to Irish airports and ports. Anyone coming into Ireland, apart from Northern Ireland, will be required to either restrict their movements or self-isolate on arrival for 14 days. This includes Irish residents. Essential supply chain services such as hauliers, pilots and maritime staff are exempt.	Yes (since March 12)	The government has advised that indoor mass gatherings of 100 people or more and outdoor mass gatherings of more than 500 people should be cancelled. All State-run cultural institutions have closed, as have pubs. On 24 March, the government announced further containment measures, including i) all theatres, clubs, gyms/leisure centres, hairdressers, betting shops, marts, markets, casinos, bingo halls, libraries and other similar outlets to shut; ii) all hotels to limit occupancy to essential non-social and non-tourist reasons; iii) all non-essential retail outlets are to close to members of the public and all other retail outlets are to implement physical distancing<Br/>all cafes and restaurants are to limit supply to take away food or delivery; iv) all sporting events are cancelled, including those behind closed doors<Br/>all playgrounds and holiday/caravan parks will close; v) all places of worship are to restrict numbers entering at any one time to ensure adequate physical distancing<Br/>all organised social indoor and outdoor events of any size are not to take place. On 27 March, the government advised that everybody should stay at home until 12 April 2020, except for the following situations:<Br/>i) to travel to and from work, or for purposes of work, only where the work is an essential health, social care or other essential service and cannot be done from home<Br/>to shop for essential food, beverage and household goods or collect a meal<Br/>ii) to attend medical appointments and collect medicines and other health products<Br/>for vital family reasons, such as providing care to children, elderly or vulnerable people<Br/>iii) to take brief individual physical exercise within 2 kilometres of your home.<Br/>iv) always observe 2 metres physical distancing<Br/>v) you may take children from your own household outdoors for physical exercise<Br/>vi) farming purposes, that is food production or care of animals.	The Irish health system was already experiencing significant challenges at the onset of the COVID-19 outbreak, but a number of measures are being put in place to support the delivery of health services at this critical time. These include agreement with GPs to ensure that cost is not a barrier to accessing services, the utilisation of private hospital capacity, and an expansion in both acute and community capacity. <Br/>The most recent data available at the onset of the crisis suggested Ireland had 2.8 acute care hospital beds per 1,000 inhabitants. This is low compared with many other European countries. For instance, Germany had six acute care beds per 1,000 inhabitants (the highest across the European countries).   <Br/>The Government has allocated extra funding of the order of &euro;1 billion (0.5% of GNI*) to the Health Service Executive for improving capacity in the health service, including using private hospital capacity, increasing staffing and overtime, developing home testing and remote management solutions for mildly ill patients and pushing community awareness and preventive actions. The package will also be used to promote greater use of technology and telephone support. Further health-related measures of a similar financial scale are under active consideration.<Br/>To support public health policy, the Minister of Finance has increased the limit for contactless payments (to EUR 50 per transaction). <Br/>	Unavailable information	A package of sick pay and illness/supplementary benefits has been introduced to ensure that employees and the self-employed can abide by medical advice to self-isolate where appropriate, while having their income better protected than under current social welfare rules. For example, the government has waived the requirement for six waiting days for sick pay in respect of medically certified cases of self-isolation in accordance with public health guidelines and has removed the means test requirement for Supplementary Welfare Allowance in respect of medically certified cases of self-isolation. <Br/>There have also been measures announced to try and encourage businesses to keep workers in employment and to support those who have lost their jobs. On 24 March, the government announced: <Br/>i) a temporary wage subsidy of 70% of take home pay up to a maximum weekly tax free amount of EUR 410 per week to help affected companies keep paying their employees; <Br/>ii) workers who have lost their jobs due to the crisis will receive an enhanced emergency COVID-19 Pandemic Unemployment Payment of EUR 350 per week (an increase from EUR 203 per week); <Br/>iii) the COVID-19 Illness Payment will be increased to EUR 350 per week; <Br/>iv) the self-employed will be eligible for the COVID-19 Pandemic Unemployment Payment of EUR 350 directly from the Department of Employment Affairs and Social Protection.<Br/>The government is also introducing legislation to prevent both the termination of residential tenancies and any rent increases for the duration of the COVID-19 crisis. Furthermore, the Commission for Regulation of Utilities has issued a moratorium on disconnections of domestic customers for non-payment to the gas and electricity suppliers.<Br/>	The government has announced financial supports for businesses, including; <Br/>i) a &euro;200 million Strategic Banking Corporation of Ireland Working Capital scheme; ii) a &euro;200 million Rescue and Restructuring Scheme available through Enterprise Ireland for vulnerable but viable firms; iii) the Microfinance Ireland COVID-19 Loan includes an option for a moratorium on interest and repayments for the first six months; iv) Local Enterprise Offices in every county will be providing vouchers from &euro;2,500 up to &euro;10,000; v) a Finance in Focus grant of &euro;7,200 will be available to Enterprise Ireland and Údar&aacute;s na Gaeltachta clients.<Br/>The government has also agreed with local authorities that they should defer business rates payments due from the most immediately affected businesses, primarily in the retail, hospitality, leisure and childcare sectors, until the end of May. <Br/>There have also been a variety of taxation measures to alleviate short-term difficulties. For example; i) interest on late payments has been suspended for January/February VAT and both February and March PAYE (Employers) liabilities; ii) all debt enforcement activity is suspended until further notice; iii) current tax clearance status will remain in place for all businesses over the coming months; iv) the Relevant Contract Tax rate review scheduled to take place this month (March) is suspended; v) critical pharmaceutical products and medicines will be given a Customs 'green routing' to facilitate uninterrupted importation and supply.<Br/><Br/>Banking Initiatives <Br/>Following consultation with the Government and the Central Bank of Ireland, the Banking & Payments Federation of Ireland (BPFI) members that includes the five retail Irish banks and main non-banks, have agreed a coordinated approach to assisting customers affected by COVID-19. These measures include:<Br/><Br/>* a payment break for up to three months (to be followed by on-going reviews depending on the scale and extent of the situation) for all personal (including personal and buy-to-let mortgages), SME and corporate customers;   <Br/><Br/>* seeking to ensure that such a payment break will not adversely impact the borrower's credit record (the details of this to be discussed with the Central Bank of Ireland); and<Br/><Br/>* banks and non-banks deferring court proceedings or any other enforcement action for three months.<Br/>	The Central Bank has cut the Counter Cyclical Capital Buffer from 1% to 0%. This decision will free up bank capital that can be used to provide credit, and to restructure and extend the loans of bank customers, both individuals and SMEs.<Br/><Br/>The ECB has committed to "do everything necessary within its mandate" to support the economy through this shock. To preserve bank lending and liquidity, the ECB will temporarily conduct additional longer-term refinancing operations (LTROs) and lower the interest rate applied in targeted longer-term refinancing operations (TLTRO III). On the supervisory front, the ECB has temporarily lowered bank capital requirements and introduced flexibility regarding the treatment of non-performing loans. Furthermore, the ECB has expanded its asset purchase programme by an overall EUR 870 billion (7.3% of euro area GDP) until the end of 2020, while opening the door to freeing its self-imposed limits. More details and additional measures are presented in the EU note.<Br/>	
ISL	30-Mar-2020	64.826	-18.417	Iceland	Voluntary quarantines	No travel bans. Icelanders returning from abroad are requested to self-quarantine	Since 12 March secondary schools and universities are closed for four weeks. Primary and pre-schools remain open	Gatherings above 10 people prohibited	No particular support measures. Mass tests are carried out at mobile stations outside hospitals.	A package of both spending measures and tax deferrals has been decided on March 22, measuring 230bn krona or 1.5bn Dollar (8% of GDP)	Up to 75% of salary for short-term workers or unemployed; one-off child benefit payment; access to third pillar pensions (private savings)	Deferral of tax payments; financial support for tourism sector; refund of VAT for construction projects. Public investment projects will be advanced.	Key policy rate lowered from 2.75% to 2.25 on March 11 and to 1.75% on March 18. Also the Bank reduced the countercyclical capital buffer on financial institutions from 2% to 0% and the deposit institutions average reserve requirement from 1% to 0%.	
ISR	30-Mar-2020	30.992	34.834	Israel	- As of 9 March all Israelis returning from abroad are ordered into a 14-day quarantine. This measure will be in effect for two weeks initially.<Br/>'<Br/>- partial lockdown (since 20 March, further tightened 25 March): People are ordered  to stay home except for essential trips (e.g.work, food, medical appointments) (to be reassessed every week). Workplace restrictions with only around 30% of employees being physically  allowed to go to work (since 20 March for 4 weeks). 	Since12 March all non-Israelis will be barred completely from entering Israel unless they can demonstrate that they have a place to self-isolate in Israel for 14 days. This extends previous measures that were confined to travellers from most affected countries in Asia and Europe. 	All educational institutions are closed including pre-schools and kindergartens	 <Br/>-  all indoor gatherings exceeding 10 people are barred<Br/>-<Br/>- all non-essential commercial shops and entertainment venues are closed, including shopping malls, cinemas, bars and restaurants	NIS 1 billion allocated to health system (11 March) to increase health sector capacity, including for the procurement of protective gear, medicine and respirators, to increase the number of hospital beds for corona virus patients and the number of tests for the virus.	A first emergency package of NIS 10 billion (0.7% of GDP) announced on 14 March, including NIS 1 billion for health sector, NIS 1 billion for special needs (police, fire service, food security), fund for state guaranteed loans of NIS 8 billion for SMEs (off balance sheet measure).<Br/><Br/>Further measures announced on March 16 include broadened eligibility to unemployment benefits, tax deferals, grant for the self-employed.<Br/><Br/>Overall support measures of around NIS 35 billion (2.5% of GDP).<Br/>.	- All employees on involuntary unpaid leave for at least 30 days will be able to claim unemployment benefits after 5 day. Unemployment benefits can be claimed after employment for the least 6 months, from 12 months previously. Unemployment benefits for tourist guides.<Br/>'<Br/>- Grant of up to NIS 6000 for March and April for people over 67 years who quit a job (27 March)<Br/>'<Br/>- Ministry of Finance instructed banks to allow for a 4-months postponement of mortgage payments (15 March)<Br/>	- Fund for state guaranteed loans of NIS 8 billion for SMEs (increased from previously NIS 4 billion announced on 10 March). Since 29 March, no interest payments for borrower in first year (state pays instead).  <Br/>'<Br/>- VAT, municipal taxes and social security contribution have been deferred for SMEs until the end April<Br/>'-Grants up to  NIS 6,000 for all small businesses and self employed. Criteria to be determined	On 15 March BOI announced<Br/>'<Br/>- start of purchasing government bonds of various types and maturities in the secondary market (on 23 March specified to totallying NIS 15 billion, 3.5% GDP)<Br/><Br/>- offering repo transactions to financial institutions with government bonds as collateral (undisclosed amount)<Br/><Br/>- a list of regulatory leniencies for banks (e.g. higher LTV for all purpose HH loans backed by real estats), aimed at preventing a tightening in credit conditions and to support the economy<Br/>-18 March BOI announced to offer banks one-week US dollar swaps up to NIS 15 billion. <Br/>-On 29 March the banking supervisor reduced the regulatory capital requirement for banks by 1 percentatge point	
