ISO3	update	lat	lng	Country	quarantines	travel_Bans	schools_closure	public_events_cancel	Health	Overall_fiscal_measures	Fiscal_people	Fiscal_firm	Monetary_Prudential
NZL	30-Mar-2020	-42.558	172.377	New Zealand	Returning residents and citizens must isolate themselves for 14 days upon arrival.	New Zealand closed its border to all foreign non-residents on 20 March. Only New Zealand citizens or permanent residents and their families are allowed to enter the country. Some exceptions include Australian citizens living in New Zealand, citizens of Samoa and Tonga, health and other essential workers.<Br/>Increasingly stringent containment measures were implemented prior to 25 March. On 25 March, New Zealand moved to the most stringent level (4) of its containment system for at least four weeks. At this level, people are instructed to stay home; schools, universities and non-essential businesses are closed; there is a major reprioritisation of health services; and travel is severely restricted 	Childcare, schools and university closed from Wednesday 25th.	On 25 March, New Zealand moved to the most stringent level (4) of its containment system for at least four weeks. At this level, people are instructed to stay home <Br/>- public events are cancelled and public places are closed.	In the context of the Covid-19 support measures announced on 17 March, NZD 500 million was allocated to the health sector.   	The government announced a massive package of support measures on 17 March amounting to NZD 12.1 billion (4% of GDP), with one half to be implemented in the coming year. Most (NZD 8.7 billion) of the fiscal measures are to support businesses and jobs while NZD 2.8 billion were allocated to increase social benefit payments and NZD 500 million (0.2% of GDP) were allocated to the health sector. The package is expected to boost GDP growth by 2 percentage points in the coming year and by further small amounts over the following two years. This package comes on top of the NZD 12 billion increase in infrastructure spending announced in January.     	The NZD 2.8 billion increase in benefit payments will come in the form of a NZD 25 per week increase in core benefit payments and a doubling in the winter energy payment to $1400 for couples and $900 for single people. Also, the threshold for In Work Tax Credit has been removed.  	The NZD 8.7 billion fiscal support for business and jobs includes NZD 5.1 billion in immediate wage subsidies and NZD 2.8 billion in business tax changes including a provisional tax threshold lift, introduction depreciation write-offs for commercial and industrial buildings, increased low value asset write-offs, writing off interest on late payments. Also, NZD 600 million will be spent on support for the aviation industry. 	On 15 March, the Reserve Bank of New Zealand (RBNZ) cut its policy rate (the overnight cash rate) by 75 basis points to 0.25%, and committed to maintain this rate for at least 12 months.<Br/>As regulatory relief, the RBNZ postponed the start date of the increased capital requirements for banks initially planned for 1 April by 12 months, to 1 July, 2021.<Br/>On 20 March, the RBNZ announced measures to supply banks with more liquidity via both Foreign Exchange swaps and the reinstated Term Auction Facility, which offers banks term funding of up to one year against a range of collateral. The US Federal Reserve and the RBNZ entered into a USD 30 billion USD swap arrangement to enable the RBNZ to borrow USD if needed. The swap will be in place for at least six months.<Br/>On 22 March, the RBNZ announced a Large Scale Asset Purchase programme (LSAP) of New Zealand government bonds (quantitative easing) amounting to NZD 30 billion (about 10% of GDP) over 12 months.<Br/>v. On 24 March, the government and RBNZ announced a support package for homeowners and businesses impacted by the economic effects of Covid-19. The package will include a six-month interest and principal payment holiday for mortgage holders and SMEs who have lost income because of the economic disruption caused by the Covid-19 crisis. The RBNZ will help banks to put this scheme in place with appropriate bank capital rules. In addition, the RBNZ has reduced banks' core funding ratios (i.e., funding from deposits and long-term domestic borrowing) from 75% of assets to 50% to support increased lending. The government will implement the Business Finance Guarantee Scheme (NZD 6.25 billion) for solvent SMEs, with the government bearing 80% of the risk of these loans and banks the remaining 20%.       <Br/>On 24 March, the government and RBNZ announced a support package for homeowners and businesses impacted by the economic effects of Covid-19. The package will include a six-month interest and principal payment holiday for mortgage holders and SMEs who have lost income because of the economic disruption caused by the Covid-19 crisis. The RBNZ will help banks to put this scheme in place with appropriate bank capital rules. In addition, the RBNZ has reduced banks' core funding ratios (i.e., funding from deposits and long-term domestic borrowing) from 75% of assets to 50% to support increased lending. The government will implement the Business Finance Guarantee Scheme (NZD 6.25 billion) for solvent SMEs, with the government bearing 80% of the risk of these loans and banks the remaining 20%.     	
POL	30-Mar-2020	52.442	19.72	Poland	Around 62511 people are under quarantine and around 53,426 are currently under epidemiological surveillance (as of 24 March). Public containment has been implemented on the 24th of March and It will last until 11.04. Mandatory 14-day quarantine for all people coming from abroad.	Poland introduced full checks on its EU borders until 13 April. Restrictions on border traffic with Russia, Ukraine and Belarus were introduced until further notice. Right to enter the country has been limited to Polish citizens and some foreign citizens, including spouses and dependants of Polish citizens, foreign citizens with temporary and permanent residence permits and work permits.	All schools and university closed until April 14	All public events have been cancelled and public meetings of more than 2 people have been banned. Non-essential shops are closed.	On 8 March, the authorities unlocked 23.3 million EUR (98 million PLN) for hospitals on 28 February. On 19 March, the Government has announced additional 7,5billion PLN package for health sector in the framework of Covid19 Measures (Tarcza Antykryzysowa)	On 8 March, the President signed the bill on extraordinary measures to contain the spread of coronavirus. Measures include easier conditions for remote working for persons subject to quarantine or epidemiological surveillance, care allowance for parents whose children are affected by closures of nurseries and schools, additional powers for provincial governors to take containment measures, and the possibility to suspend the application of the public procurement law and construction laws.<Br/>COVID19 Measures (Tarcza Antykryzysowa)<Br/>The government has announced (subject to parliamentary approval) a fiscal package (including the establishment of a public infrastructure investment fund) with approximately PLN 66 billion (2.9 percent of GDP) from the state budget, in additional to PLN 75 billion (3.2 percent of GDP) in guarantees and micro loans for entrepreneurs (to the amount of PLN 5,000).<Br/>	On March 11, The President promised additional reliefs for people having financial problems because of the coronavirus, possibly through loan rescheduling.<Br/>COVID Measures, 19.03 (Tarcza Antykryzysowa) <Br/>- subject to the parliamentary approval<Br/>1. For qualifying companies that meet the criterion of recorded losses and decrease in turnover, the government will subsidize the employees' salaries of up to 40% of the average statutory wage. The employer must pay the same percentage of the employees' salaries whereas employees must agree to decrease of their salaries by one fifth. The subsidy will be provided on condition that the employer will not make any employees redundant 3. the government will subsidize remunerations of individuals working on the grounds of service and similar contracts and self-employed of up to 80% of the statutory minimum wage.<Br/>	COVID19 Measures, 19.03 (Tarcza Antykryzysowa) <Br/>- subject to parliamentary approval<Br/>1. postponement of payment of social contributions and possible deferral, payment in installments, or cancellation of taxes; 2. deduction of this year's losses for 2021 tax settlement; 3. increased guarantees from the national development bank (BGK) for enterprises; 4. additional loans for micro-firms<Br/>	The National Bank of Poland (NBP) reduced its policy interest rate 50 bps to 1 percent on March 17. The NBP has re-introduced repo (fine-tuning) operations to provide liquidity to banks, has reduced required reserve ratio  from 3.5 to 0.5 percent as well as raised the interest rate on required reserve to the level equal to the policy interest rate. The NBP announced the purchase of Polish Treasury securities (quantitative easing) in the secondary market and purchased PLN 8.3 billion (0.4 percent of GDP) through March 23. The NBP also announced introduction of a program to provide funding for bank lending to the non-financial private enterprises (akin to the ECB's TLTRO). <Br/>The Ministry of Finance, following the recommendation by the Financial Stability Committee, repealed the 3 percent systemic risk buffer for bank capital requirements. The Polish Financial Supervisory Authority (PFSA) also announced a package of measures (SSP <Br/>- Supervisory Stimulus Package) related to provisions and reclassification of loans to existing SMEs/micro enterprises, as well as measures to enable the smoothing of credit losses over a longer period, allow some flexibility in how banks meet capital requirements, and flexibly approach bank liquidity requirements. The PFSA also announced a flexible approach to valuation under Solvency II for the insurance sector. Additionally, the Polish Banking Association has recommended voluntary deferral of loan payments for affected borrowers for up to three months.<Br/><Br/>- On 16 March, the Central Bank announced the provision of liquidity-providing repo operations to the banking system, the provision of TLTRO-type refinancing of non-financial corporate loans and large scale Treasury-bond purchases.  <Br/>- On 16 March, the Systemic Risk Board waived banks' contributions to the systemic risk buffer, reducing bank capital requirements.	
PRT	30-Mar-2020	40.957	-7.799	Portugal	Public containment has been implemented on the 19th of March. It will last until the 2nd of April.	Border control with Spain through mutual agreement started on 17th of March. Suspended air, rail and river connections until 15th of April. <Br/>-Movement of goods and authorized persons at only 9 border points, including nationals and residents returning home, family reunion and cases of access to health units in bilateral health care agreements. Boat traffic on both Minho and Guadiana rivers and train traffic is only allowed for circulation of goods.<Br/><Br/>- Flights to and from Italy are also suspended from 11th of March.<Br/><Br/>- Suspension of flights from/to extra-EU on 19th of March. Exceptions: flights to countries with strong presence of PT communities (CA, US, UK, ZA), with all PT-speaking countries, EEA (NO, IS, LI, CH).<Br/><Br/>- 14-day isolation period for all passengers on flights to the Azores and Madeira, since 14th of March.<Br/><Br/>- Temperature control sensors in airports (Lisbon, Porto, Faro, Madeira, Ponta Delgada), 20th of March.<Br/><Br/>- COVID-19 support telephone line for consular emergencies (Portuguese abroad), 13th of March. <Br/>	Suspension of all face-to-face school activities (teaching and non-teaching) from 16th of March to be reassessed on 9th of April.	Closure of non-essential shops (i.e. nightclubs, bars, and restaurants) <Br/>Closure of all national monuments and places of cultural activities (both public and private).<Br/>Suspension of religious and cult celebrations.	On the 12th of March, the authorities unlocked 296 million EUR to increase the capacity of the health sector. Other health-related measures include: a) suspension of overtime limits; b) simplifying the hiring of workers; c) worker mobility; d) hiring retired doctors without being subject to age limits.<Br/><Br/>- Exceptional regime for public procurement and expenditures in the health sector, allowing swifter procedures and more transparency in public spending (including ventilators, protective equipment, diagnostic support material).<Br/><Br/>- Special protection regime for professionals in the health sector directly involved in the diagnosis and specialized laboratory response. Exceptional regime for composition of medical boards to assess needs of people with disabilities. Special duty of protection to risk group (+70 year-old / severe disease) with call for limited mobility.<Br/><Br/>- Mandatory curfew to all tested positive or in active surveillance (in hospital, or at home). <Br/><Br/>- General call to avoid unnecessary displacements and to promote social distancing.<Br/><Br/>- National Contingency and Response Plan for Disease by the new Coronavirus. <Br/>The Portuguese government has been developing three areas of action, the commitment with the Joint Procurement Agreements developed by the European Commission, the purchase of protective equiment on international markets and the use of the national capacity and availability in production of protective equipment and medical equipment to support the breathing of patients.	On March 13th, the government announced a package of measures, including a 200 million EUR credit line to support firms' liquidity, a 60 million EUR credit line to support micro-companies in the tourism sector, and the deferral on fulfilment of fiscal obligations and reporting requirements regarding CIT and payment on account, additional payment on account and special payment on account. On March 18th, the government announced a second package worth 9.2 billion EUR package, of which 5.2 billion EUR are fiscal measures such as flexible payment schedules for tax payments, 3 billion EUR are state-backed credit guarantees and 1 billion EUR relate to social security payments to support workers and provide liquidity for companies affected by the coronavirus outbreak. 	Parents who need to stay home to take care of their kids (up to 12 years old) and who cannot telework cannot be laid-off for unjustified leave but will receive 2/3 of their salary during that period. These 2/3 of salary will be paid half-half by the employer and the social security. Thus, the employer pays 1/3, the social security pays 1/3, and the individual pays 1/3.<Br/><Br/>- Training subsidy of 50% of prior earnings, up to minimum wage, plus the cost of training, for workers without occupation for a long period as a result of the Covid-19 crisis.<Br/><Br/>- The equivalent of 14 days sick absence leave for workers who have to self-isolate or isolate their children or grandchildren, as a prophylactic measure.	3 billion state-backed credit guarantees are provided by firms. <Br/>-Direct state guaranteed credit support to companies that are most affected (&euro;200 million) and for microenterprises in the tourism sector (&euro;60 million). <Br/>-State guarenteed credit through the banking system: for restaurants (&euro;600 million, &euro;270 million for SMEs), tourism (&euro;200 million, &euro;75 million for SME), tourism accommodation (&euro;900 million, &euro;300 million for SME), industry (&euro; 1.300 million, &euro;400 million for SME), fishing and aquiculture sectors (&euro;20 million).<Br/><Br/>- Increased ceilings for export credit insurance schemes for metallurgic, mould, metal and mechanical industries (&euro;100 million), construction abroad (&euro;100 million), short-term exports (&euro;50 million).<Br/>-'"Temporary lay-off scheme" for firms with activity severely affected by the epidemic. Severely affected firms are those who show a decline in turnover of 40% compared to the previous three months or those that started their business less than 12 months ago. Workers will receive 2/3 of their gross income, up to 1905&euro; per month. Firms pay 30% of that sum while the social security pays the remaining 70%. This can last up to 6 months maximum. The social security is fully covering the costs of workers who are under a 14 days quarantine, i.e. exempting companies from paying salaries. <Br/>-Flexible tax payments for companies and the self-employed, regarding VAT payments, PIT and CIT, which look as follows: 1) payment in three instalments with no late payment interest being charged; or 2) payment in six instalments with late payment interest being due only over the last three instalments. Applicable to self-employed workers and companies with turnover up to &euro;10M in 2018 or starting on January 1, 2019. Remaining companies or independent workers may require the same flexibility in Q2, if turnover decreases at least 20%.<Br/>-For self-employed and companies with a turnover of up to EUR 10 million in fiscal year 2018 or that have started the activity after 1 January 2019, it will be possible to defer the withholding tax payment	Smaller credit institutions, under the supervision of Banco de Portugal and not the ECB, can temporarily operate with a lower level of minimum capital requirements and lower levels of liquidity than usual.<Br/>Rescheduling of banking loans, with maturities extended.	
ROU	30-Mar-2020	45.933	25.119	Romania	A nation-wide lockdown has been in place since March 25. Movement of persons outside their residence is not allowed, except for purchasing basic goods, travelling to work, obtaining medical assistance that cannot be postponed or performed remotely, taking care of dependants (children, elderly, ill or disabled) and pets, in case of death of a family member, and outings for individual physical activity. Restrictions for persons over 65 years old are stricter, with outings allowed only between 11 am and 1 pm. <Br/>All persons entering Romania are home-isolated or quarantined, depending on the country they are arriving from (red or yellow areas).	Since March 25, Romanian borders are closed for foreign citizens and stateless persons (with exceptions, for instance for those transiting Romania over designated transit corridors). <Br/>All commercial flights to and from France, Germany, Spain, and Italy have been suspended (with exceptions, especially for freight and postal services). The access of maritime or fluvial-maritime ships into the maritime-Danube-harbours is allowed only after a period of 14 days of quarantine from the last stop-over-harbour located in a yellow/red area.               <Br/>	Schools and kindergartens have been closed since March 11.	Since March 18, non-essential shops have been closed. All public events have been cancelled and all indoor activities, such as cultural, sports and religious events have been banned. Since March 22, commercial retail activities and services located in shopping malls have been suspended with the exception of food retail, veterinary and pharmaceutical products and laundry services.	The budgets of the Ministry of Health and the Ministry of Internal Affairs have increased by RON 392 million and RON 100 million respectively. A loan of maximum RON 1.15 billion will be allocated to the state-owned company UNIFARM for the emergency purchase of sanitary equipment. A mobile hospital is being built near Bucharest to accommodate potential COVID-19 patients and the ministry of Defence has launched a recruitment campaign of medical staff.<Br/>Since March 24, the hospitalizations and consultations in outpatient structures of public and private hospitals that are not urgent have been suspended.	The payment deadlines for local taxes (cars, building, and land) have been postponed to end of June with a 10% discount.<Br/>Interest and penalties on due and outstanding fiscal obligations are suspended (until the end of the state of emergency + 30 days).<Br/>New measures were announced on March 26, including tax deductions on the corporate income tax and VAT exemptions on imports of medical and sanitary devices that can be used to prevent, limit and combat COVID-19.<Br/>	Paid leave is granted to parents in response to the temporary closure of schools (for children up to 12 years old or up to 18 years old for children with disabilities and when working from home is not possible). <Br/><Br/><Br/><Br/>	Employees temporarily laid off in firms affected by the outbreak will receive at least 75% of their gross salary (up to 75% of the average gross wage). Firms that either stopped their activity completely or partially due to the state of emergency and hold a certificate issued by the Ministry of Economy (available online, as of April 2020) or have reduced their revenues by at least 25% (compared to the average level of Jan-Febr 2020) can receive unemployment benefits, but for no more than 75% of the total number employees. RON 4 billion have been allocated which could cover 1 million employees according to official estimates.<Br/><Br/>SMEs obtaining an emergency certificate can benefit from an extension of the payment deadlines for utilities services (electricity, natural gas, water, telephone and internet services) and rents. Penalties related to delays in the execution of public contracts are suspended during the state of emergency period.<Br/><Br/>The State guarantee scheme has been expanded and subsidised interest rates for small and microenterprises will be temporarily allocated (RON 5 billion)<Br/><Br/>The government also announced tax relief measures, including the acceleration of VAT refunds, the suspension of most tax audits and of foreclosures on overdue debtors, amendments of the tax debt restructuring programme and of the calculation of the corporate income tax base.	A package of measures was announced on 20 March (implemented on 23 March):<Br/><Br/>- cut in the policy rate by 0.50 percentage points (to 2%)<Br/><Br/>- cut in the lending (Lombard) facility rate by 1 percentage point (to 2.5%, the deposit facility rate is maintained at 1.5%). <Br/><Br/>- provision of liquidity to credit institutions through REPO operations (reversible securities transactions)<Br/><Br/>- purchase of government securities denominated in national currency on the secondary market<Br/><Br/>The EU regulatory framework will be applied in the prudential and accounting fields. Banks are allowed to use capital buffers and operate with lower liquidity ratio.<Br/><Br/>Loan payments can be suspended for 9 months for individuals and firms affected by the outbreak. Credit institutions are allowed to temporarily reduce or suspend loan amortisation payments without applying the regulatory provisions on the level of indebtedness, the loan-to-value limit, and the maximum maturity of consumer credit.	
RUS	30-Mar-2020	64.736	104.062	Russia	Self-quarantine for those infected	Entry ban for all foreigners from March 18, except from CIS countries	All schools and university closed until April 12	All gatherings of more than 50 people prohibited	Local authorities are setting up emergency hospitals	On March 19 a number of new economic and regulatory measures were announced, including creating an anti-crisis fund of 300 billion roubles ($4.05 billion) for support to people and firms. On March 25 the president specified the measures	Consumer credit and mortgage repayment holidays for those whose incomes fall by more than 30%; paid holiday for all workers for 28 March-5 April; higher unemployment benefits to the level of the minimum wage; additional child benefits for up to 3 years;<Br/><Br/>	Postponement of all taxes except VAT for SMEs for 6 months; postponement of insurance and social payments for microbusinesses for the same period; credit repayment holidays of 6 months for SMEs in difficulty; tax breaks for airlines and firms in the tourism sector; 15% dividend tax to payments made to offshore accounts; 13% tax on income from investments over RUR 1m. Possibility for businesses to get preferential loans	No interest rate cut so far (last on February 10). MinFin could sell foreign exchange reserves to stabilize the rouble and said it would do so	
