ISO3	update	lat	lng	Country	quarantines	travel_Bans	schools_closure	public_events_cancel	Health	Overall_fiscal_measures	Fiscal_people	Fiscal_firm	Monetary_Prudential
ARG	30-Mar-2020	-33.166	-64.31	Argentina	The government has ordered complete confinement of the population from 20 until 31 March. Police is controlling the streets and non-compliance with measures is prosecuted as criminal offence. All overseas arrivals are required to self isolate for 14 days.	All borders are entirely closed as of 27 March.	All schools and universities closed as of March 16	All shops and public spaces are closed from March 20 until 31, only supermarkets and pharmacies as well as certain parts of public administration remain open.	The construction of 8 new emergency hospitals has been announced and the government requested help from China for delivery of respiratory equipment and testing facilities and plans to purchase 500,000 reagents to start large-scale testing. Doctors and other staff in public and private hospitals will receive a one-off bonus of 470 USD. All workers in the health sector will receive a monthly bonus of 75 USD from April until July 2020. Prices for personal care, drugs and medical products have been fixed for 30 days. Exports of medical equipment necessary for the treatment of COVID infected patients require prior authorisation from the government.	Increases in public investments of around 1.5 Billion USD, mainly in road infrastructure, housing and school construction as well as infrastructure for tourism. Public credit subsidies for private housing constructions introduced by the previous government will be reinstated and extended, providing opportunities to refurbish homes during confinement.	Households that live from informal activities or self-employment and have suffered income losses will receive a one-off bonus of USD 150 in April. Conditional cash transfers to poor families are boosted by a one-off bonus of USD 50. Retirees with minimum pensions will obtain a USD 50 one-off bonus, and non-contributory pension benefits are topped up to the level of the regular minimum pension. New rules require employers to continue to pay part of the salaries of all confined private sector workers. People aged 60 and above, pregnant women and people in risk groups are dispensed from going to work and cannot face negative consequences as a result. Prices for food, personal care, drugs and medical products have been fixed for 30 days and public food programmes are expanded. Doctors and other staff in public and private hospitals will receive a one-off bonus of 470 USD. 	For firms in strongly affected sectors such as entertainment, transport, restaurants and hotels, the government will pay part of the salaries and exempt employers from social security contributions. Public banks will support private companies with subsidised credit of up to 5.7 Billion USD for up to 180 days with rates reduced to around half of the current yearly inflation. Part of these credits will be directed to companies producing foodstuff, healthcare items and hygienic articles as well as equipment necessary for teleworking. 	Unavailable information	
AUS	30-Mar-2020	-24.578	133.582	Australia	From 9pm AEDT 20 March 2020, only Australian citizens, residents and immediate family members can travel to Australia. All travellers to Australia are required to self-isolate for 14 days, either at home or in a hotel. Interstate travel is possible, but individual states have introduced a requirement to self isolate for 14 days after arrival. 	Only Australian citizens, residents and immediate family members can travel to Australia. All Australians are not allowed to take a return trip overseas, unless in exceptional circumstances. Cruise ships from foreign ports are banned.  <Br/>On 27 March 2020, the Western Australian government imposed restrictions on travel within the state. Western Australians will not be permitted to leave their regional boundary unless under exceptional circumstances (e.g. employment purposes, medical reasons, health and emergency services, people living in border communities, transport of essential goods, compassionate grounds). 	No national blanket closure of schools. Public schools in several sub-national jurisdictions have moved to online-only learning. Private and independent schools exercise discretion on closure and delivery methods.	The government has suspended non-essential gatherings. Essential gatherings are limited to 500 people for outdoor gatherings and 100 people for indoor gatherings. Where possible, people are advised to keep 1.5 metres between themself and others and there should be no more than one person per 4 square metres.<Br/>On 25 March 2020, tighter restrictions were imposed on weddings, funerals, fitness classes, beauty salons, arcades, play centres. Pubs, licensed clubs and hotels (excluding accommodation), places of worship, gyms, indoor sporting venues, cinemas, casinos must close. Takeaway only at restaurants and cafes.<Br/>	The Government has committed an additional $2.4 billion to support the health system to manage any further outbreak in Australia. The package provides support across primary care, aged care, hospitals, research and the National Medical Stockpile, along with a national communication campaign. The package also provides funding to ensure Australia has sufficient PPE and medicines in addition to infection control training and programs for health and aged care workers. On 15 March 2020, the Prime Minister announced that health services had moved into the 'Targeted Action' stage of the Australian Health Sector Emergency Response Plan for Novel Coronavirus (COVID-19). This included moving resources within hospitals to priority areas, establishing fever clinics which specialise in COVID-19, cancelling elective surgeries to free up capacity in public hospitals and adapting hospital resources (i.e. rooms and equipment) for use in priority areas, such as Intensive Care Units.	In addition to the Commonwealth Governments AUD$64bn package, state governments have also announced their own stimulus packages:<Br/><Br/>* The Victorian government announced a AUD$1.7bn (0.1% of GDP) stimulus that included a fund to provide employment for some dismissed workers, payroll tax refunds for businesses and supports for firms in the worst-affected sectors. <Br/><Br/>* The New South Wales government announced a AUD$1.6bn (0.1% of GDP) package that included payroll tax relief for firms and new capital projects. <Br/><Br/>* The Queensland government have announced a AUD$3.2bn (0.2% of GDP) stimulus including the establishment of a loan facility for impacted businesses and payroll tax relief. <Br/><Br/>* The Western Australian government announced a AUD607mn package (0.03% of GDP) that included a freeze on household fees and charges and payroll tax relief for firms. <Br/><Br/>* The Tasmanian government announced a AUD$839mn (0.04% of GDP) package that included payments to households, interest free loans to small businesses and payroll tax waivers for businesses in sectors most heavily impacted and targeted industry assistance.<Br/><Br/>* The South Australian government announced a $650 million jobs rescue package including a fund to provide employment opportunities, payroll tax relief, land tax relief, a once-off boost of $500 for households who are receiving the welfare support and a waiver of liquor licence fees for 2020-21 for those hotels, restaurants, cafes and clubs forced to close. <Br/><Br/>* The Australian Capital Territory announced a $137 million stimulus package targetting vulnerable households through cash payments and small business through the provision of credit and a fund for contractors to undertake simple works on government assets. <Br/><Br/>* The Northern Territory announced a $115 million stimulus package including payroll tax exemption, grants to businesses and not-for-profit and community organisations and a home improvement scheme. <Br/>	There has been a temporary expansion of eligibility for income support payments and the establishment of a new, time-limited Coronavirus supplement to be paid at a rate of A$550 per fortnight.  This will be paid to both existing and new recipients of various government benefits. The supplement will be paid for the next six months. Social security and veteran and other income support recipients and eligible concession card holders will receive up to two separate cash payments of $750. Those who do not receive the Coronavirus supplement payment will receive a second cash payment totalling AUD$750. The government will also allow the unemployed and some workers and sole traders adversely affected by COVID-19 to access up to $10,000 of their superannuation in 2019-20 and a further $10,000 in 2020-21. 	New measures include: support for business investment, incl. by increasing the threshold for assets eligible for instant tax write-off and expanding access of this regime to larger firms (with annual turnover of <500 million AUD up from <50 million AUD), as well as through new accelerated depreciation measures; and boost business cash flows (incl. through payments to SMEs that employ workers to help finance payments of salaries and wages plus wage subsidies to SMEs to support them in retaining apprentices and trainees). A range of measures have been taken to allow firms that are affected by the pandemic to defer payment of tax liabilities for up to 4 months without incurring  interests or penalties for late payment (incl. for income taxes, goods and services tax (GST), excises and fringe benefits tax). This is complemented with measures to accelerate tax refunds, notably of excess input-GST credits. Under a new Coronavirus SME Guarantee Scheme, the Government will guarantee 50 per cent of new loans issued by eligible lenders to SMEs. The total lending capacity of the facility will be AUD$40bn (2% of GDP). Under a plan put forward by the banking industry, small businesses impacted by the coronavirus crisis will be able to defer their loan repayments for six months.<Br/>	The central bank cash rate was cut by 25 basis points on 3 March. Then, on 19 March, the central bank announced additional measures including 1) A reduction in the cash rate target to 0.25 per cent (from 0.5 per cent), 2) A target for the yield on 3-year Australian Government bonds of around 0.25 per cent. On 19 March, the Reserve Bank of Australia announced the introduction of a term funding facility for the banking system, with particular support for credit to small and medium-sized businesses. The facility will have AUD90bn of capital (4.5% of GDP). It was also announced that Exchange Settlement Balances at the Reserve Bank will be remunerated at a rate of 10 basis points, rather than zero as would have been the case under previous arrangements. <Br/>The government will also allocate AUD15bn (0.7% of GDP) to the Australian Office of Financial Management to invest in wholesale funding markets used by smaller lenders. <Br/>On 19 March, the Australian Prudential Regulation Authority announced that it would tolerate bank capital levels that were below benchmark capital targets as long as institutions demonstrate that they can meet their various minimum capital requirements. On 20 March, the central bank announced that it would establish a temporary reciprocal currency swap arrangement with the US Federal Reserve for the provision of US dollar liquidity. 	
AUT	30-Mar-2020	47.65	14.705	Austria	Two popular ski regions (Paznauntal, St.Anton/Arlberg) in Tyrol have been under quarantine since March 13, the Gasteinertal, Grossarltal and Flachau (all in the Salzburg region), the rest of Tyrol, parts of Vorlarlberg (Lech, Warth, Schr&ouml;cken, Kl&ouml;sterle, Nenzing-Dorf, Beschling) and Carinthia (Gemeinde Heiligenblut) since March 19.  	The government has restricted access on Austria's external borders for all neighbouring countries besides the Czech Republic and the Slovak Republic. However, both borders are closed from the respective other side, the Czech Republic restricts commuter traffic. Transit (and freight transport) is still possible. Official air traffic and external train traffic is suspended.	Latest since March 16, all schools are closed.	Austrian authorities have enforced a country-wide curfew since 16 March. As of 10 March, big indoor and outdoor events have been cancelled and the government closed the external border with Italy. On 13 March, authorities announced the closure of schools from 16 March on and closed all shops besides supermarkets, pharmacies and a couple of other essential shops (a full list of businesses still allowed to open is found here). Museums, monuments, restaurants and bars are also closed. All events with more than five people are prohibited. In addition, municipal council elections in Styria and Vorarlberg (initially scheduled for 22/03) have been postponed until further notice.	Due to the closed borders especially with Hungary and Slovakia, maintaining 24h long-term care of the elderly is a major problem. Around 66,000 care-takers work in the labour-intensive 24h care. Austrians constitute only 1.6% of 24h care-takers. Around 50% of these care-takers come from Romania who currently cannot cross the Hungarian border and a further 30% from the Slovak Republic. Slovaks, the second largest group among care-takers, are only allowed to enter if their place of work is not more than 30km from the border. Though the Austrian government is in negotiations with its neighbours no solution has been reached so far. For the moment, the government has introduced two immediate measures for the 460.000 persons in need of care. Firstly, the government is seeking former Civilian Servants who completed their service within the last five years to step in. While this pool amounts to around 45,000 persons, the government estimates that about 14.600 additional Civilian Servants can be mobilized this way, who are also needed in other areas. Secondly, federal provinces are setting up additional capacities for mobile and stationary care, financed through a EUR 100 million fund from the federal government. Another 60 million are granted to the health system and EUR 130 million are given to hospitals for equipment and to finance over-time payments. A number of hotlines have been set up to provide Austrian with up-to-date and free info on the corona virus. The Ministry of Social Affairs, Health, Care and Consumer Protection set up a taskforce to provide scientific advice from a medial point of view. 	Chancellor Kurz has announced a comprehensive support package on 18 March amounting to up to EUR 38 Billion (around 10% of GDP but including tax deferals). The package encompasses credit guarantees of EUR 9 billion, a compartment for immediate help of EUR 4 billion, including EUR 400 million for short-time work via the Public Employment Service Austria (AMS), tax deferrals of up to EUR 10 billion and EUR 15 billion in form of credit guarantees and subsidies for hard-hit industries. Firms affected can claim a deferral of social contributions for the months February to April. Additional funds will be put aside to support the production of gloves, masks and several medicines in Austria. Further EUR 23 million are disbursed through an emergency-call for research by the Austrian Research Promotion Agency (FFG) to incentivize eligible research on Covid-19 by Austrian firms.	All workers (private and public sector) can be requested to use two weeks of their leave and to deplete over-time hours. Short-time working (EUR 400 million, 0,1% of GDP): The budget of the Public Employment Service Austria (AMS) was increased from EUR 20 million to EUR 400 million. It takes over the salary of all workers (except public service) including apprentices of min. 10% up to 90% of the working time according to collective bargaining agreements up to a certain threshold. This threshold depends on gross salary and is 90% for salaries below EUR 1,700, 85% for salaries below EUR 2,685 and 80% for salaries below EUR 5,370; apprentices will be compensated in full. Any application to the short-time working scheme will be handled within 48h. The Ministry of Finance will take over one third of labours costs for workers who have to take care of children up to an age of 14 due to closed schools or kindergartens.	Credit guarantees (EUR 9 billion, 2.3% of GDP): EUR 2 billion is devoted to the export credit scheme and intends to cover up to 15 % of operating costs of exporting companies. The Austria Wirtschaftsservice Gesellschaft (aws), a federal development and financing bank, supports firms of all sizes in all industries except the tourism sector, which is covered by the public Tourism bank. Those who are self-employed can tap the credit guarantees as well. The aws covers only credits necessary to preserve liquidity but does not cover debt restructurings. The minister of Finance has been entitled to increase the guarantee envelope. Emergency assistance (EUR 15 billion, 3.8% of GDP) to support industries hit hard by the coronavirus crisis. Part of this emergency assistance is devoted to "hardship" cases across self-employed and micro-sized firms. Under certain conditions, they can get subsidies of up to EUR 6,000 for three months per entity. These subsidies have to be paid back.	The ECB has committed to "do everything necessary within its mandate" to support the economy through this shock. To preserve bank lending and liquidity, the ECB will temporarily conduct additional longer-term refinancing operations (LTROs) and lower the interest rate applied in targeted longer-term refinancing operations (TLTRO III). On the supervisory front, the ECB has temporarily lowered bank capital requirements and introduced flexibility regarding the treatment of non-performing loans. Furthermore, the ECB has expanded its asset purchase programme by an overall EUR 870 billion (7.3% of euro area GDP) until the end of 2020, while opening the door to freeing its self-imposed limits. More details and additional measures are presented in the EU note.	
BEL	30-Mar-2020	50.773	4.809	Belgium	Containment measures were reinforced as of March 18, which will remain in place until April 18. Citizens are required to stay at home, except for work and daily necessities (food shops, post office, bank, pharmacy, hospitals, etc.). All public gatherings are prohibited.	Non-essential travel outside Belgium is prohibited. 	Schools remain open, but classes and school activities are interrupted. (Schools take care of children, organised by internal staff, whose parents work in the care sector or essential public services or have no other care solution than their grandparents.)  	Non-essential shops and retail outlets are closed from 18 March until April 5. Firms are obliged to organise telework and, if this is not possible for certain employees, social distancing will be strictly respected. If firms cannot meet these obligations, they must be closed temporarily. These measures will apply until April 18. 	The federal government provides additional resources to grant a cash advance to hospitals, which will be regulated taking account of exceptional costs and loss of revenues (around EUR 1 billion, 0.2% of GDP).	* All payment deadlines for personal income tax, corporate income tax, VAT and withholding tax are automatically extended by two months. <Br/><Br/>* Additional measures to delay payments of tax arrears. In certain cases, no late-payment interest will be due and penalties for not paying taxes will be waived. Additional flexibility in payment of tax arrears for businesses in distress, including payment deferments, payment in instalments and waiver of interest and/or penalties for late payment <Br/>- upon request.	* Include Covid-19 as a reason for temporary unemployment due to force majeure.<Br/><Br/>* Companies affected by a decline in their sales for fear of contagion may grant their employees temporary unemployment for economic reasons. The granting of temporary unemployment is automatic and extended.<Br/><Br/>* For those on temporary unemployment, benefits were raised from 65% to 70% of gross wages, supplemented by a lump-sum benefit of EUR 5.63 per day for those who are on temporary unemployment. <Br/><Br/>* The payment of mortgages/credits and premiums for fire insurance and outstanding balance insurance for families, viable firms and the self-employed can be deferred until end September 2020 without charging any fee.  <Br/>	* The payment of social security contributions for H1/2020 is postponed until mid-December for employers and the self-employed.<Br/><Br/>* The self-employed are also entitled to "bridging right" (replacement income) of EUR 1 291.69 per month (EUR 1 614.10, if they have dependent family members) if they are forced to stop their activity. <Br/><Br/>* Flexibility in the performance of federal public contracts. Accelerated payment period for public procurement service providers.<Br/><Br/>* The payment of mortgages/credits and premiums for fire insurance and outstanding balance insurance for families, viable firms and the self-employed can be deferred until end September 2020 without charging any fee.  <Br/><Br/>* A guarantee scheme by the federal government and the financial sector was set up (total EUR 50 billion, worth 10.6% of GDP), guaranteeing all new credits and credit lines with a maximum term of 12 months (excluding refinancing credits) provided until 30 September 2020.<Br/><Br/>* Reduction of tax prepayment for the self-employed if they consider that their income is lower than the amount used to calculate their contribution.<Br/>Selected regional measures:<Br/><Br/>* Brussels: EUR 110 million to support companies (These include one-off premium of EUR 4 000 for all companies affected by the emergency measures and that are required to close, liquidity support to companies etc.). <Br/><Br/>* Wallonia: EUR 350 million fund to help firms, health and social industries and local authorities (These include EUR 5 000 for companies that have been shut down or cannot work and retail (EUR 2 500 if they are partially closed), liquidity support to companies, etc.).   <Br/><Br/>* Flanders: Different measures to support firms (These include interruption premium of EUR 4 000 for all companies or shops that must stop their activities;  EUR 100 million of guarantees for firms and the self-employed, etc.).<Br/>	The National Bank of Belgium announced the decision to reduce the counter-cyclical buffer to zero, releasing approximately EUR 1 billion worth of capital available to Belgian banks to expand lending. 	
