ISO3	src	update	xls_saved	lat	lng	Country	Confinement__Confinement-measures	Social-Measures__Reducing-workers-exposure-to-Covid-19-in-the-workplace	Social-Measures__Income-support-to-sick-workers-and-their-families	Social-Measures__Income-support-to-quarantined-workers-who-cannot-work-from-home	Social-Measures__Helping-dealing-with-unforeseen-care-needs	Social-Measures__Income-support-to-persons-losing-their-jobs-or-self-employment-income	Social-Measures__Helping-firms-to-adjust-working-time-and-preserve-jobs	Social-Measures__Financial-support-to-firms-affected-by-a-drop-in-demand	Social-Measures__Changes-to-dismissal-regulation	Social-Measures__Helping-economically-insecure-workers-stay-in-their-homes	More__Government-links-for-more-details
AUS		June 24, 2020		-24.578	133.582	Australia	A variety of facilities closed for at least the next six months, including restaurants, cafés, gyms, sporting venues and places of worship. Schools still remain open, but some state governments (notably Victoria, New South Wales and the Australian Capital Territory) have signalled an intention to unilaterally embark on school closures. Public gatherings of more than two people are banned as is overseas travel for Australian citizens.   Any arrivals in Australia are quarantined for 14 days.  The deconfinement plan is as follows: • Step 1 will allow gatherings of up to 10 people, up to 5 visitors in the family home and some local and regional travel (within-state). Some retail and small cafes and restaurants will also be able to reopen. • Step 2 will allow gatherings of up to 20 people, and the reopening of gyms, beauty services and entertainment venues like galleries and cinemas. • Step 3 will allow gatherings of up to 100 people. Arrangements under step 3 will be the ‘new normal’ while the virus remains a threat. International travel and mass gatherings over 100 people will remain restricted. The government has also released the CovidSafe App for tracing potential outbreaks. 		As of 20/03, sick or injured workers who cannot do their usual work or study can receive unemployment benefits (Job Seeker Payment), in addition to two weeks of employer paid sick pay (accrued because of one year tenure) For COVID-19 cases, the income means test of the UB has been increased and the asset limit and job-seeking requirement has been suspended (but it still has a means test component). The requirement to provide a medical certificate to apply for the Job Seeker Payment has been waived for people who cannot work or study because of the coronavirus. The exact benefit level depends on family situation. Moreover, the gov’t has adopted income top-ups for individuals who receive an eligible income support (including UB and sickness allowance), with the Coronavirus supplement and the One-off Economic Support Payment.   	Private-sector employees in mandatory quarantine or self-isolation are not entitled to employer-paid sick pay. They can take two weeks of unpaid pandemic leave if they cannot access other leave entitlements. However, they can receive the JobSeeker Payment (UB) in case of mandatory quarantine due to COVID-19 if they meet the other required requirements. Also applies to self-employed and casual workers.   Social assistance scheme: Workers in quarantine or self-isolation can also get a Crisis Payment (Special Benefit), which is a last resort payment for those not eligible to other payments (such as JobSeeker Payment). It depends on current income, not previous earnings. 	The Early Childhood Education and Care Relief Package is a payment to support childcare services, including Centre Based Day Care, Family Day Care, Outside School Hours Care and In Home Care, to remain open. To receive these payments child support services must prioritise care to essential workers, vulnerable and disadvantaged children and previously enrolled children, must not charge any fees for sessions of care provided.  With the COVID-19 outbreak, employees (incl. casual workers) are entitled to take 2 days of unpaid carer’s leave if they have to look after a family member who is sick with the COVID-19 or to care for a child due to the school closures (only if they have no paid sick or carer’s leave left for full-time or part-time employees). Australia also expanded access to income support payments to persons required to take care of someone affected by COVID-19. Workers (incl. casual workers & the self-employed) can receive the JobSeeker payment if they care for someone who is affected by COVID-19. Those not entitled to the Job Seeker payment can receive the Crisis Payment (Special Benefit) if they are caring for someone required to be in quarantine or self-isolation.	Temporary expansion of eligibility for income support payments and the establishment of a new, time-limited Coronavirus supplement to be paid at a rate of A$550 per fortnight. This will be paid to both existing and new recipients of various government benefits. The supplement will be paid for the next six months. Social security and veteran income support recipients and eligible concession card holders who do not receive the Coronavirus supplement payment will receive a $750 one-off payment (in addition to a $750 one-off payment already announced in the government’s first stimulus package). The Government has also taken measures to support retirees.  Sole traders, self-employed, casual workers and contract workers are entitled to the Job Seeker Payment & Coronavirus Supplement in case of sickness or mandatory quarantine, if they meet the required criteria.	Wage subsidy to businesses (A$130bn or 6½% of GDP) to encourage them to keep workers in jobs. A “JobKeeper Payment” of A$1,500 per fortnight per eligible employee will be paid to the business under the condition that every eligible employee receives at least A$ 1,500 per fortnight from the business. The Jobkeeper Payment covers full-time and part-time employees, as well as employees stood down ahead of the commencement of the scheme, casual employees who have been employed for at least 12 months and the self employed. Eligible businesses are those with a turnover of less than A$1 billion that can demonstrate a 30% decline in turnover relative to a comparable month one year ago (firms with turnover of greater than A$1 billion must demonstrate at least a 50% reduction in turnover).  The Government is supporting small business to retain their apprentices and trainees. Eligible employers can apply for a wage subsidy of 50 per cent of the apprentice’s or trainee’s wage for 9 months from 1 January 2020 to 30 September 2020. Where a small business is not able to retain an apprentice, the subsidy will be available to a new employer that employs that apprentice	The Government plan to support businesses in managing short-term cash flow challenge is manifold: - Boosting Cash Flow for Employers: up to $100,000 to eligible small and medium-sized businesses, and not-for-profits (NFPs) that employ people, with a minimum payment of $20,000. - Temporary relief for financially distressed businesses: The Government is temporarily increasing the threshold at which creditors can issue a statutory demand on a company and to initiate bankrupt proceedings against. - Increasing the instant asset write-off from $30,000 to $150,000 and expanding access to include businesses with aggregated annual turnover of less than $500 million (up from $50 million) until 30 June 2020. - Backing business investment: time-limited 15 month investment incentive (through to 30 June 2021) to support business investment and economic growth over the short term, by accelerating depreciation deductions. - Co-ordinated actions have been taken by the Government, the Reserve Bank of Australia and the Australian Prudential Regulatory Authority to ensure the flow of credit in the Australian economy.		Temporary suspension of evictions from rental properties (for 6 months)  Major banks have agreed to allow households to postpone mortgage repayments temporarily, with interest capitalisation.  	https://treasury.gov.au/sites/default/files/2020-03/Overview-Economic_Response_to_the_Coronavirus_0.pdf https://www.parliament.nsw.gov.au/bill/files/3741/Passed%20by%20both%20Houses.pdf 
AUT		June 24, 2020		47.65	14.705	Austria	All shops except for essentials are closed until further notice, schools are closed, travel restrictions, large gatherings are restricted	Occupational hygiene measures, organizational measures and personal protective measures to protect employees from risks related to exposure to biological agents were clarified with decree 		According to the Epidemic Act, an employee who is quarantined by the doctor or the authorities because of the coronavirus (i.e infected or suspected to be infected) and is therefore unable to work, is entitled to sick pay from the employer (can be refunded by the state). The employee does not need a sickness certificate in this case because he/she is not necessarly sick. This does not apply to employees who are quarantined abroad.   An employee who self-isolate because belongs to a risk group (due to age, pre-existing or current conditions) is also entitled to sick pay, paid by the employer and refunded by the state. However, the risk-group status must be certified by a doctor (via phone or visit) and this does not apply to workers of the core sectors like health, transportation or supermarkets.	Workers with children under 14 can get up to three weeks special family leave with continued payment of salaries by the employer in full. The government will reimburse employers for one third of wages (up to a maximum) for workers who take this special leave. The leave can be taken in blocks.   Some schools and childcare facilities remain open, with a skeleton staff, to look after children of essential service workers.  Since 15 April, a Corona family hardship fund (EUR 30 million) is operational, from which families in a dire economic situation can draw up to EUR 1200/month for up to 3 months, contingent on the particular income situation of the family.	Unemployment assistance (2nd tier) raised to the same benefit level as unemployment insurance benefit (1st tier)	New type of short-time working scheme, called "Corona Kurzarbeit", available for six months: • In the case of "temporary, non-seasonal" economic difficulties (e.g. caused by a drop in sales) due to the corona virus, company employees have the option of reducing their working hours by 10-90% for 3+3 months (in the calculation period, working hours can also be reduced to 0 hours temporarely). • The financial means are available for small and large companies in all sectors; a social partner agreement is a prerequisite for the use of the „Covid19-short-time work“ and the holiday entitlements and time credits of the employee must be used up in advance. • Employers must undertake to pay short-time compensation at least until 90% (for a gross salary up to 1700 euro), 85% (for a salary up to 2685 euro) and 80% (for a salary between 2685 euro and 5370 euro) of the previous net salary; in the end, the financial burden of the companies (e.g. through social security contributions) through Covid19-short-time-work remains very low.  • The employment level in the companies must be maintained during the „Covid19-short-time-work“ and one month beyond. • It should be possible to agree short-time working with the Public Employment Service-PES (AMS) within 48 hours. 	EUR 100 million to guarantee loans for SMEs in the tourism sector to alleviate liquidity concerns. Another EUR 10 million aside to guarantee loans. Tax payments have been deferred. The government also announced regulatory reforms to temporarily offer relief for financially distressed firms. The threshold at which creditors can issue a statutory demand on a company and the time companies have to respond to statutory demands have been temporarily increased. The package also includes temporary relief for directors from any personal liability for trading while insolvent. 			https://www.sozialministerium.at/Informationen-zum-Coronavirus/Coronavirus---Rechtliches.html   https://www.sozialministerium.at/Informationen-zum-Coronavirus/Coronavirus---Aktuelle-Maßnahmen.html  
BEL		May 12, 2020		50.773	4.809	Belgium	Schools are closed, non-essential shops and public spaces are closed, large gatherings are banned.	Teleworking compulsory in non-essential sectors, and encouraged in essential sectors when possible. When telework is not possible, employers need to guarantee a social distance of at least 1.5 meters. Employers can grant an tax and social security-free expense allowance to their teleworking employees (EUR 170 per month) to cover telework-related costs that workers might face (e.g. desk, office materials). 	Diagnosed workers fall under the normal regulations for incapacitation to work. A medical opinion by telephone confirmed by the doctor by means of a simplified certificate is sufficient. For workers in the healthcare sector, Covid-19 can be seen as an occupational disease	- Temporary unemployment available and the associated benefits are increased from 65% to 70%.  - Temporary unemployment due to force majeure extended by three months, until June 30, 2020. - Allowance from the National Employment Service of EUR 5.63 per day (on top of benefits) for temporary unemployed 	Parents with childern below 12 years old are entitled to request an special part-time family leave for the period 1 May to 30 June. Employers can reject the request. Paid by the federal social insurance programme through a flat-rate benefit of EUR 352 per month. Workers who have to stay at home because a household member is infected can also get temporary unemployment benefits.	- Replacement income for self-employed who were forced to stop their activity or chose to stop their activities for at least 7 consecutive days because of difficulties. - Revision of tax pre-payment amount possible for self-employed whose income is projected to be lower than the one used as reference for the pre-payment calculation.  - Possibility of postponement, or full or partial exemption of social security contributions for self-employed.   Flanders:  - Encouragement premium given to workers who see a reduction in working hours in firms that experience a fall of 20% or more in revenues, production or orders (available from April to June 2020). 	- Temporary unemployment is automatic now, meaning that employers do no longer need to justify it; Benefits for employees on temporary unemployment are increased from 65 % to 70% for a period of three months on, and temporary unemployed receive an additional daily allowance from the National Employment Service; - EUR 5.63 per day is given to those in temporary unemployment (on top of the 70% of their wage) - No longer a difference between temporary unemployment due to force majeure and economic reasons  Flanders:  - Encouragement premium given to workers who see a reduction in working hours in firms that experience a fall of 20% or more in revenues, production or orders (available from April to June 2020). 	Belgium:  - More flexibility in payment terms of taxes and social security contributions.  Flanders: - EUR 100 million for loan guarantees. The aim is to make it easier for firms to get credit from banks to finance their working capital. - Firms that need to close are entitled to a one-off EUR 4000 obstruction premium, and additional compensation of EUR 160 per day beyond 21 days of closure. This also holds for restaurants that continue their operations through take-away.  - Firms that face a substantial fall in revenues (at least 60%) can receive a EUR 3000 compensation premium - Postponement of certain regional taxes (e.g. property tax).  - Firms having difficulties repaying their loans or credits can postpone their payments until 30 September Wallonia:  - EUR 5000 premium for small firms and self-employed that had to close and EUR 2500 for those who had to reduce their operations. - Guarantees on short-term and investment loans.  - Loans to support firms with urgent liquidity needs (up to EUR 200 000 repayable within 1 year at a fixed 2% interest rate).  - Loan to support self-employed: max EUR 45 000, repayable within at most 5 years (75% government guarantee) Brussels:  - Employers that were forced to close can get a EUR 4000 premium if they have less than 50 FT employees.  - Guarantees on bank loans (EUR 20 million total).  - Exemption for certain taxes (e.g. City tax, tax on taxi exploitation).  - Re-enforcement of advice services to firms in difficulties. - EUR 3000 support for taxi drivers - EUR 2000 premium for self-employed and micro-enterprises who are facing a significant fall in activity 		Belgium: Home-owners facing a drop in income can get a six-month postponement of mortgage payments Flanders:  - Evictions of renters not allowed during Corona crisis.  - Allowance for households with a worker facing temporary employment to cover utility payments.  - Utilities (water, gas, power) will not be disconnected during the Covid-19 crisis. Wallonia - interest-free loans to pay rent for those facing payment difficulties (max 6 months to be repaid within 36 months) -rental contracts can be prolonged when moving is impossible - students can end their rental contract (for student accommodation) earlier - EUR 100 and EUR 75 support for electricity and gas, respectively, for families who already had issues with utility payments - water cannot be disconnected in April and May 2020	https://www.info-coronavirus.be/en  Federal: https://economie.fgov.be/fr/themes/entreprises/coronavirus/informations-pour-les/coronavirus-reduction-des   Flanders: https://vlaio.be/nl/begeleiding-advies/moeilijkhedencoronavirus/specifieke-maatregelen-mbt-het-coronavirus/coronavirus  Wallonia: https://www.1890.be/article/coronavirus-quelles-mesures-pour-leconomie-et-lemploi-en-wallonie https://www.premier.be/fr/Dix-mesures-pour-soutenir-les-entreprises-et-les-independants-dans-le-cadre-du-Covid-19  https://www.nbb.be/en/articles/guarantee-scheme-individuals-and-companies-affected-corona-crisis
CAN		June 24, 2020		59.621	-111.2	Canada	Schools and university are closed, travel restrictions, ban on large gatherings.	Where feasible, adjust policies to reduce social contact, such as: flexible hours, staggering start times, teleworking arrangements, using email and teleconferencing. Employers are responsible for protecting the health and safety of employees at work. They are required to implement preventative measures to ensure employees are not exposed to conditions that could be harmful to their health or safety while working.	Relax sick leave policies to support employees in self-isolating when ill. This includes suspending the need for medical notes and reduces the burden on an already stressed health care system.  As of 15/3, eligible workers who cannot work due to reasons related to COVID-19 (e.g. sickness or quarantine) receive temporary income support through the Canada Emergency Response Benefit (CERB). The CERB provides $500 a week for up to 16 weeks and does not have a waiting period (while ususally there is a one-week waiting period to receive the Employment Insurance (EI) sickness benefits). 	Employment Insurance (EI) sickness benefits provide up to 15 weeks of income replacement and is available to eligible claimants who are unable to work because of illness, injury or quarantine, to allow them time to restore their health and return to work. 	The Canada Emergency Response Benefit (CERB) is available to workers who have stopped working because, among other reasons, they are taking care of children (or other dependents) who are in quarantine or sick due to COVID-19 or whose care facility has closed due to COVID-19. The benefit is available to both employees and the self-employed. Paid by the federal social insurance programme. (See next column for more details on the CERB).   Additionally, the government is providing a temporary one-time boost to the Canada Child Benefit. This means that families that are currently eligible for the CCB will receive an extra $300 per child as part of their May 2020 payment. The overall increase for families receiving the child benefit will be approximately $550 on average. In total, this measure will deliver almost $2 billion in extra support.	The federal government will provide workers who lose income because of the COVID-19 pandemic $2,000 a month for the next four months under the Canada Emergency Response Benefit (CERB). To qualify, individuals must have earned $5,000 in the previous year.  Students and recent graduates who are not eleiglbe for CERB or Employment Insurance and cannot work can access $1,250 a month from May to August under the Canada Emergency Student Benefit (CESB). Additional emergency support benefit for self-employed and part-time workers who do not qualify for Employment Insurance.  Temporary Increase to the Goods and Services Tax Credit (GSTC): The Government of Canada is providing additional support to those who may require more help with their finances because of the impacts of COVID-19. For over 12 million low- and modest-income families, the Government is providing a one-time special payment in May through (GSTC). The average boost to income for those benefitting from this measure will be close to $400 for single individuals and close to $600 for couples. In total, this measure will deliver almost $5.5 billion in extra support. 	Government of Canada’s COVID-19 Economic Response Plan, will provide up to $27 billion in direct support to Canadian workers and businesses. The measures allows for eligible employers to retain skilled employees and workers to remain employed during the temporary downturn in business due to COVID-19. Extension o f maximum possible length of work-sharing agreements from 38 to 76 weeks. Emergency wage subsidies for eligible firms who have experienced a 30% drop in revenues will cover 75% of wage costs up to a ceiling for up to 12 weeks. The Temporary 10% Wage Subsidy is a three-month measure that will allow eligible employers to reduce the amount of payroll deduction required to be remitted to the Canada Revenue Agency (CRA).	• Loans: The Business Credit Availability Programme is providing $40 billion in loans to individual businesses, mostly SMEs. Individual firms can also apply the for the Canada Emergency Business Account which will provide interest-free loans up to $40,000 for SMEs and not-for-profits to help cover their operating costs during a period when their revenues are down. Other credit and liquidity support through financial Crown corporations, Bank of Canada (reduced its interest rate to 0.75%), OSFI, CMHC and commercial lenders – estimated cost in the range of CAD 500 billion. • Postponement of income tax payments:  Canada Revenue Agency will allow all businesses to defer, until after August 31, 2020, the payment of any income tax amounts that become owing on or after today and before September 2020. 		The Canada Mortgage and Housing Corporation (CMHC) launched a revised  Insured Mortgage Purchase Program, whereby the government will purchase up to CAD 50 billion of insured mortgage pools through CMHC, in order to provide stable funding to banks and mortgage lenders to ensure continued lending to Canadian consumers and businesses  Temporary suspension of eviction notices in some provinces (e.g. Ontario)  Doubling of the Reaching Home Program that provides funding for the homeless and establishment of a fund to help Indigenous communities.	https://www.info-coronavirus.be/en  Federal:  https://economie.fgov.be/fr/themes/entreprises/coronavirus/informations-pour-les/coronavirus-reduction-des  https://emploi.belgique.be/fr/actualites/update-coronavirus-mesures-de-prevention-et-consequences-sur-le-plan-du-droit-du-travail Flanders: https://www.vlaanderen.be/gezondheid-en-welzijn/gezondheid/coronacrisis-door-uitbraak-van-covid-19 Wallonia: https://www.1890.be/article/coronavirus-quelles-mesures-pour-leconomie-et-lemploi-en-wallonie  Brussels: https://1819.brussels/blog/pandemie-coronavirus-le-gouvernement-de-la-region-de-bruxelles-capitale-prend-des-mesures
