ISO3	src	update	xls_saved	lat	lng	Country	Confinement__Confinement-measures	Social-Measures__Reducing-workers-exposure-to-Covid-19-in-the-workplace	Social-Measures__Income-support-to-sick-workers-and-their-families	Social-Measures__Income-support-to-quarantined-workers-who-cannot-work-from-home	Social-Measures__Helping-dealing-with-unforeseen-care-needs	Social-Measures__Income-support-to-persons-losing-their-jobs-or-self-employment-income	Social-Measures__Helping-firms-to-adjust-working-time-and-preserve-jobs	Social-Measures__Financial-support-to-firms-affected-by-a-drop-in-demand	Social-Measures__Changes-to-dismissal-regulation	Social-Measures__Helping-economically-insecure-workers-stay-in-their-homes	More__Government-links-for-more-details
SWE		June 24, 2020		65.903	18.572	Sweden	Secondary schools and universities closed. The health authority recommends isolating people over 70 and working from home as much as possible.  Events with more than 50 persons have been banned since 27 March.	Teleworking encouraged as far as possible. 	Central government assumes the entire cost of all sick pay between April and the end of July.   The qualifying day for sick pay will be discontinued between 11 March and 30 September, i.e. the central government will pay sickness benefits for the first day of sickness. From 1 June onwards, the standard compensation will be increased by SEK 104. Suspension of medical certificate requirement for the first 14 days of sickness until 30 September. Self-employed persons will also be compensated in that they can receive standardised sick pay for days 1–14 until 30 September. Health-care workers who have been infected by COVID-19 while performing their duties are entitled to a compensation for work-related injury.	A worker unable to perform work due to being quarantined will be entitled to state disease carrier allowance from Försäkringskassan (as per applicable statutory rules on compensation). These workers will receive approximately 80 percent of their regular salary, capped to SEK 804 per day for up to 14 days (duration of quarantine). Also applies to self-employed workers. However, workers must submit a medical certificate to prove that they are suspected of being infected by COVID-19 or have a risk of carrying the disease (does not apply to people in risk groups). 	Normally, if a worker's child is ill or is a disease carrier, the worker is entitled to parental paid leave (benefit for the care of closely related persons) if he/she needs to be at home to care for his/her child and cannot work from home (providing a medical certification that the child is sick and contagious). However, under the Parental Leave Act, the worker is not eligible for a paid leave due to the care of a sick child if he/she keeps the child at home to protect him from being infected by others. With the COVID-19 outbreak, the government has proposed temporary legislation (as of 25/04) for workers who need to stay home to look after their (healthy) children because of school/preschool closures and cannot work from home; sick-child allowance for parents has been extended to cover the eventuality of school closure due to COVID-19, with a compensation of around 90 percent of their salary.	Temporary reinforcement of unemployment insurance: the funds for the Employment Service to manage newly registered unemployed and notice have been increased as well as those for the unemployment insurance funds to manage notices; the membership terms for joining an unemployment insurance fund have been shortened from 12 to 3 months; the ceiling in the unemployment insurance fund is raised temporarily from SEK 910 to SEK 1 200 per day for the first 100 compensation days; from day 101 onwards, the ceiling for income-related benefits from unemployment insurance funds is proposed to rise from SEK 760 to SEK 1 000 per day between 29 June 2020 and 3 January 2021. The ceiling for basic insurance is temporarily raised from SEK 365 to SEK 510 per day; the waiting period of 6 days before receiving unemployment benefits has been abolished.  Self-employed will received a reduction of individual contributions as that proposed for firms. Self-employed will also be able to defer their VAT payments that otherwise should be paid during the spring, such as on 12 May.   	Employers’ wage costs can be halved and the central government will cover a larger share of the costs. This model is similar to short-time work, but the subsidy level is significantly increased. Moreovor, from 1 May 2020 and for three months, employers will be able to reduce their employees’ working hours by up to 80% (instead of 60%) and the government will bear most of the cost. The wage costs will be reduced by over 70% (previously 50%), while workers will retain almost 90% of their original wage. Combined with the reduced employers’ social security contributions, employer costs can be reduced by up to 86% per cent during May and June. Control mechanisms will be enhanced. Wage negotiations have been postponed to the Autumn.  The period during which a person may have a subsidised job (extra job, new start job or introductory job) will be extended by an additional year for those who already have such jobs; the maximum time for support for starting a business will be extended from six to twelve months; municipalities will receive grants for more summer jobs for young people and funding for green jobs.   From 1 August until 30 September, the central government will compensate employers for higher sick pay costs due to the COVID-19 pandemic. The Government is currently preparing the details of the proposal.	A central government loan guarantee has been proposed to make it easier for companies to access financing. The proposal means that the central government will guarantee 70 per cent of new loans banks provide to companies (primarily SMEs) that are experiencing financial difficulty due to the COVID-19 virus but that are otherwise robust.  Almi Företagspartner AB (a state agency which offers loans to companies with growth potential and assists in their business development) will receive a capital contribution of SEK 3 billion to increase its lending to small- and medium-sized businesses throughout the country.  The Swedish Export Credit Agency's loan limit is extended to SEK 200bn (about EUR 18bn, 3.8% of GDP) from SEK 125bn. The ceiling for credit guarantees from the agency which insures export companies and banks against the risk of non-payment in export transactions (EKN) is increased to SEK 500bn (about EUR 45bn, 9.6% of GDP) from SEK 450bn, the same amount as during the 2008 financial crisis.  The cultural sector and sports movement will receive an extra SEK 1 billion in support.  The Government proposes that airlines be able to receive credit guarantees in 2020 amounting to a maximum of SEK 5 billion, of which SEK 1.5 billion is intended for SAS. A temporary reduction of employers’ social security contributions will be proposed for the period 1 March to 30 June 2020 so that only the old age pension contribution is paid (up to 30 employees and on that portion of the employee’s wage that does not exceed SEK 25 000 per month). Support to facilitate and speed up renegotiation of rents. Small enterprises: 100% of the taxable profits of sole proprietors and partners in Swedish partnerships for 2019, up to SEK 1 million, can be set aside in the tax allocation reserve, which can then be set off against possible future losses. VAT reported by sole proprietors annually from 27 December 2019 to 17 January 2021 will be eligible to deferral, with interest. Temporary discount for rental costs in vulnerable sectors (restaurants etc): central government will cover 50 per cent of the rental reduction, up to 50 per cent of the fixed rent. Support to businesses based on loss of turnover (measure currently being prepared): businesses with a turnover of at least SEK 250000 during the past financial year and a loss of turnover of at least 30 per cent will be able to file for support (between 22.5 and 75 per cent of the business’s fixed costs excluding wage costs, depending on loss of turnover in March and April 2020). The maximum amount will be set at SEK 150 million per business.			https://www.government.se/government-policy/the-governments-work-in-response-to-the-virus-responsible-for-covid-19/ https://www.fi.se/en/published/press-releases/2020/loss-of-income-due-to-corona-virus-disease-a-cause-for-exemption-from-amortisation/
CHE		June 24, 2020		47.012	8.351	Switzerland	Gatherings in public spaces of more than five people are prohibited until 10/5/2020. If five or fewer people meet, they must maintain a distance of two metres from one another. All establishments open to the public will be closed, except establishments such as food stores and other shops selling articles for everyday use (e.g. kiosks and petrol station shops), takeaway establishments, staff canteens, meal delivery services, pharmacies or banks. From 27 April, hospitals will then be able to resume all medical procedures, and medical practices, hairdressers, massage practices, cosmetic studios, DIY stores, garden centres and florists will be able to reopen.If the situation allows, schools for children of compulsory school age will be allowed to reopen on 11 May. Entry restrictions for all persons (except from Liechtenstein). Exceptions are possible, for example for people who live or work in Switzerland. Anyone wishing to enter Switzerland despite the entry ban must prove that one of the exceptional conditions is met. This arrangement will apply for a maximum of 6 months.	Hygiene regulations for companies, recommendations for home office. Employers in construction and industry are obliged to comply with the recommendations of the Federal Office of Public Health regarding hygiene and social distance. For this purpose, the number of persons present on construction sites or in companies must be limited accordingly. People at high risk should work from home. If that is not possible, they are to be placed on leave by their employers, but will continue to be paid by their employer.	COVID-19 is recognised as an occupational disease for workers having an activity presenting a hightened risk, such as medical personnel. Other workers with some risk, but more limited (for exemple vendors) are not concerned. SUVA (the Swiss National Accident Insurance Fund) can pay a daily allowance for accident or occupational disease to an infected worker if the COVID-19 infection has been proven and recognised as an occupational disease.	“Corona-Erwerbsersatz Quarantäne”: Persons who are in quarantine and have to interrupt their employment are entitled to compensation if, at the time of the interruption, they are compulsorily insured with the old age provision (i.e. live in Switzerland or are gainfully employed in Switzerland); and are engaged in an employed or self-employed activity. Compensation of 80% of average income up to a maximum daily ceiling of CHF 196 per day, provided with no waiting period and for 10 working days for employees and 30 working days for the self-employed (payments ended on 16 May 2020 for the self-employed able to reopen their business). 	“Corona-Erwerbsersatz Eltern”: Parents with children under 12 years of age who have to interrupt their employment because of school or child care facility closures due to the COVID-19 epidemic are entitled to paid leave. Available for: (1) workers with children under 12 years of age; (2) parents with minors who are entitled to an intensive care supplement; (3) parents of children up to the age of 20 years if they attend a special school. Paid at 80% of earnings, up to a ceiling of CHF 196 per day, with a 3-day waiting period. This applies both to employees and self-employed workers (30-day limit for the self-employed). The entitlement will end once schools/child care facilities re-open for employees. Financed by public social insurance.	• Unemployed persons are covered by compulsory unemployment insurance. The submission of proof of job search efforts is waived. All persons entitled to benefits receive a maximum of 120 additional daily allowances.  • Entitlement to short-time work was extended: Employees in fixed-term employment, apprentices, temporary workers, workers on call and employer-like employees (members of management, business owners, etc.)  as well as their spouses who work for them, are entitled to SWC. Persons in an employer-like position as well as spouses are entitled to a lump sum of CHF 3,320. Furthermore, the Federal Council has suspended the companies' co-payment for recourse to short-time work compensation. • Self-employed persons: If they suffer a loss of income due to the closure of a business or the ban on events ordered under federal law (i.e. are directly affected), they are entitled to compensation amounting to 80 percent of their income and a maximum of 196 Swiss francs per day.  • All other self-employed persons who are only indirectly affected by the measures to protect against the corona pandemic, but who nevertheless suffer a loss of earnings, are entitled to compensation (80 percent of their income and a maximum of 196 Swiss francs per day) if their income is at least CHF 10,000 per year, but does not exceed CHF 90,000 per year (hardship rule). (decision by Federal Council of 16 April. Entry into force retroactively) • Further measures for persons in the cultural sector (hardship payments).	The administrative procedures to apply for short-time work (part-time unemployment benefit) have been eased at short notice: i) the waiting period to benefit from this indemnity is eliminated until September 30, 2020 (against 2 days previously, the first days being borne by the company); ii) Employees no longer have to reduce their overtime before they can benefit from short-time compensation. iii)The approval period for short-time work is extended from 3 to 6 months. This will allow the number of applications to be minimised and thus speed up the approval procedure. In addition, urgent simplifications have been made in the area of processing applications and payments for short-time work with the adoption of new provisions. Short-time work compensation can now also be paid to employees on fixed-term contracts and to persons working for a temporary work organisation. Furthermore, short-time work compensation is accessible for employer-like employees (for example, shareholders of a limited liability company who work as salaried employees in the company), persons who work in the business of the spouse or registered partner as well as apprenticees, too.	CHF40 billion for a liquidity aid. Affected companies can apply to their banks for bridging credit facilities representing a maximum of 10% of their annual turnover and no more than CHF 20 million. Credits of up to CHF 500,000 will be fully secured by the Confederation, and will be paid out quickly and with the minimum of bureaucracy. Zero interest will be charged. Bridging credits that exceed CHF 500,000 will be secured by the Confederation to 85% of their value; the lending bank will secure the remaining 15%. Each company can obtain a credit of this type for up to CHF 20 million, which means a more rigorous bank review will be required. The interest rate on these credits is currently 0.5% on the loan secured by the Confederation. Further liquidity measures: Businesses should have the possibility to extend payment deadlines without having to pay default interest. For this reason, the interest rate for VAT, customs duties, special excise taxes and incentive taxes will be reduced to 0.0 percent in the period from 21 March 2020 to 31 December 2020. No interest will be charged during this period. Social insurance contributions: Companies affected by the crisis may be granted a temporary, interest-free deferral of payment of social security contributions. Companies also have the option of having the amount of the regular contributions adjusted if the sum of their wages has fallen significantly. The same applies to self-employed persons whose turnover has collapsed.   			https://www.bag.admin.ch/bag/en/home/krankheiten/ausbrueche-epidemien-pandemien/aktuelle-ausbrueche-epidemien/novel-cov/massnahmen-des-bundes.html; https://www.bsv.admin.ch/bsv/fr/home.html; https://www.seco.admin.ch/seco/fr/home/Arbeit/neues_coronavirus.html
TUR		April 6, 2020		39.144	34.188	Turkey	Social distancing measures encouraged. Curfew for citizens above 65. Intercity travel is prohibited, subject only to individual permits by state governors. International flights have been completely stopped. Schools are closed until the end of April, students started to receive online education through the internet and TV. Universities shifted to full on-line education via their distance education centers and Higher Education Council's courses platform. Mass prayers in mosques are suspended. All kinds of scientific, cultural, and artistic and similar meetings or activities were postponed until the end of April. Activities open to the public are closed. Public transportation vehicles are required to accept 50 percent of their capacity to allow social distancing. Preventive and protective measures are taken in nursing homes for seniors, women's shelters and nursing homes for children under state's protection. Until 1 July 2020, banks or other financial institutions will not be able to force sales of homes whose owners cannot meet their mortgage payments.	All civil servants above 60, except special cases, will stay home until further notice. All leaves are suspended in public health services.  A circular was issued that allows civil servants for flexible and tele-working. (Flexible working and tele-working options are possible and encouraged in private sector as well).  44.986 OSH (occupational health and safety) professionals started to provide trainings for workplaces on hygiene measures and protection from coronavirus.	A complementary budget of 2 billion Turkish lira (308 million US$) is earmarked for families in need.  7 billion Turkish liras ($1.08 billion) is earmarked in support for workers with minimum wage.			A complementary budget of 2 billion Turkish lira (308 million US$) is earmarked for families in need.	The conditions of use of the Short-Time Working Allowance are eased: - The requirement of 600 days of contribution is reduced to 450 days - The requirement of service contract for the last 120 days is reduced to 60 days. - The application procedure has been simplified through decreasing the number of the application documents. - The criterion of “not laying off workers” has been brought for employers who want to benefit from the Programme.  Compensatory working time has been increased from 2 months to 4 months in order to ensure continuity in employment.	• April, May and June VAT and social security contributions will be postponed for six months in selected sectors. These include retail trade, iron-steel, automotive, logistics-transportation, cinema-theatre, housing, food-beverage, textile-garment and event-organisation services. • The accommodation tax in hotels and tourism facilities will be waived until November. • The VAT rate for domestic flights will be lowered from 18 percent to 1 percent for 3 months. • Exporters will be given stock financing assistance to maintain capacity during the slowdown. • Public SME bank Halkbank will postpone interest and debt payments for a minimum period of 3 months. Bankers’ Association invited all members to consider the special circumstances for loan re-scheduling. • The Credit Guarantee Fund increased its limits for SME loans from 3.8 to 7.7 billion US$. • New working capital loans will be made available to all firms, conditional on their preserving their current employment level, within a 25.000 Turkish Lira limit, 36 months maturity, 6 months grace period and subsidised 7.5% interest rate; • A "craft-and-trade credit card" will be made available to all craftsmen and small traders under a 25.000 Turkish Lira limit;                                                               • Firms established in technoparks will be exempt of rents for two months;  			https://tccb.gov.tr/en/ https://www.iletisim.gov.tr/english
GBR		June 24, 2020		52.289	-1.259	United Kingdom	Strict confinement and only essential services. Can leave the house only to buy necessities, do exercise, for medical needs  and for work that cannot be performed from home.	Encourage workers to work from home if possible. Employers should take every possible step to facilitate their employees working from home, including providing suitable IT and equipment to enable remote working. Workers who cannot work from home can leave their houses to go to work.	Statutory sick pay (from employers) from day 1, not day 4. Statutory sick pay for all those advised to self isolate, regardless of whether sick.‒ statutory sick pay for self-quarantined people. ESA (the sick pay benefit for those who don’t get sick pay from employer) from day 1, not day 8. As of 06/04, SPP set at £95.85 per week (less than 30% of the national minimum wage) paid by the employer for up to 28 weeks (flat rate). SPP previously was £94.25 per week.	The government introduced statutory sick pay for self-quarantined people. Workers (employees and self-employed) unable to work because (1) diagnosed with COVID-19; (2) self-isolating / quarantined for at least 4 days as they might be infected or medical proof of being "clinically extremely vulnerable"; or (3) in line with medical or government advice regardless of whether sick or not ('incapable of work') are entitled to a benefit from the first day of sickness or isolation. Same rules as for sick workers for employees and self-employed or workers not eligible for SSP.	Employees who are unable to work because they have caring responsibilities resulting from the coronavirus (COVID-19) can be put on the short-time work scheme (see right). Employees on the short-time work scheme can receive 80% of their salary, up to GDP 2500 per month, funded by general taxation and paid through the employer.  Self-employed workers who are unable to work because they have caring responsibilities resulting from the coronavirus (COVID-19) may be able to receive grants through the Self-Employment Income Support Scheme (see right).  Schools will shut but some premises will remain open, with a skeleton staff, to look after children of essential service workers.	The Universal Credit standard allowance will increase by £1,000, for the next 12 months, as will the Working Tax Credit basic element. Self-employed people with an average trading profit of under £50,000 who have lost income due to Coronavirus will be able to access taxable cash grants of 80% of profits (up to a limit of £2,500 per month) for at least 3 months. This is equivalent to the Coronavirus Job Retention Scheme for furloughed employees. The applications system is likely to be in place in mid-May with payments made in June. Until then, self-employed people have access, in full, to the Universal Credit at a rate equivalent to Statutory Sick Pay for employees. Deferral of self-assessment tax payment by 6 months. The New style Employment and Support Allowance (ESA) is provided at a rate equivalent to the SSP for employees.  In addition, there is the Self-Employed Income Support Scheme (SISS): 80% of a self-employed person’s profits will be paid by the government for up to 3 months, capped at £2,500 per month, for self-employed who cannot work because of COVID-19.	The Government has introduced a short-time work scheme. Companies and organisations can apply for a grant from HMRC to cover the wages of people who are not working due to coronavirus shutdowns, but who haven’t been laid off. The Government will cover 80% of the salaries of retained workers, up to £2,500 per month. The JRS has been extended until late October.  In the COVID-19 outbreak context, introduction of a SSP relief package for small and medium sized businesses (SMEs). These employers will be able to claim a 100% rebate on COVID-19 related sick pay paid to their employees, that will be refunded by the State for up to 2 weeks. This is a temporary measure that is currently indicated to expire on November 12 later this year. 	Vat payments have been deferred. GBP 30 billion stimulus package, including 12 bn to counter the impacts of the outbreak. For businesses <250 employees, sick pay to be paid by govt for first 14 days. Moreover: • Big loan scheme for employers • Abolish local taxes on small retail/hospitality etc businesses for a year • For the very smallest businesses, unconditional cash grant of GBP3k 		Temporary suspension of mortgage payments  Suspension of new evictions from social or private rented accommodation. The government is working with local councils to ensure that rough sleepers are provided with shelter, and secure access to food and medical services for people who have been rehoused.	https://www.gov.uk/government/topical-events/coronavirus-covid-19-uk-government-response  https://www.gov.uk/government/news/payment-holidays-offered-to-help-to-buy-homeowners-affected-by-covid-19 https://www.gov.uk/pay-self-assessment-tax-bill
