ISO3	src	update	xls_saved	lat	lng	Country	Confinement__Confinement-measures	Social-Measures__Reducing-workers-exposure-to-Covid-19-in-the-workplace	Social-Measures__Income-support-to-sick-workers-and-their-families	Social-Measures__Income-support-to-quarantined-workers-who-cannot-work-from-home	Social-Measures__Helping-dealing-with-unforeseen-care-needs	Social-Measures__Income-support-to-persons-losing-their-jobs-or-self-employment-income	Social-Measures__Helping-firms-to-adjust-working-time-and-preserve-jobs	Social-Measures__Financial-support-to-firms-affected-by-a-drop-in-demand	Social-Measures__Changes-to-dismissal-regulation	Social-Measures__Helping-economically-insecure-workers-stay-in-their-homes	More__Government-links-for-more-details
FIN		June 25, 2020		62.716	26.192	Finland	Schools are closed (current ban of in-person instruction until 13 May, the school year ends end of May); travel bans in and out of the Uusima region are lifted, but non-essential travel in Finland continues to be discouraged; public events and gatherings of more than 500 people should continue to be banned until at least 31 July; all cafes and restaurants are closed except for take-away services until the end of May.	Teleworking encouraged when possible since 12th of March 	If the employee is on sick leave because of the coronavirus infection (incapacity to work due to illness), his or her right to sick pay is determined on the basis of the Employment Contracts Act and collective agreements. Payment of salaries during sick leave is included in sectoral collective agreements.   Workers ill because of COVID-19 are entitled to the infectious disease allowance paid by the Finnish Social Security/Insurance Institution (KELA), which differs from normal "sickness allowance" received in case of incapacity to work due to illness other than COVID-19. Full compensation for the loss of income suffered, provided during the whole period of absence.   It is recommended that the employee's own statement is sufficient to justify the sick-leave pay.	Sickness allowance on account of an infectious disease to cover loss of income is available only if this has been ordered by the physician responsible for infectious disease control in the relevant municipality or hospital district. No entitlement when i) ordered by employer to stay at home after returning from abroad, ii) need to stay at home because of closure of child care centres or schools, iii) working remotely without loss of income, iv) precautionary quarantine. Temporary financial assistance due to an epidemic outbreak (see column G) can also be paid to persons arriving in Finland from abroad who have been placed in conditions equivalent to quarantine and are therefore forced to take unpaid leave from work. 	Parent employees taking unpaid leave to care for a child who normally would be in early childhood education or school are entitled to a "Temporary financial assistance due to an epidemic outbreak" benefit. The benefit is paid at a flat-rate of  EUR 28.94 per working day (EUR 723.50 per month). The temporary benefit is available until 13 May 2020, when schools and early childhood education facilities are due to re-open. It can be paid retroactively from 16 March 2020. Available to employees only. Paid by public social insurance.  Parents are also entitled to paid sick leave if they cannot work because they need to care for a child under age 16 who has been placed in quarantine. Paid at 100% of earnings. Payment is made through the employer, who is reimbursed by public social insurance. This is available to both employees and the self-employed. 	Temporary recognition of entrepreneurs and freelancers as unemployment benefit recipients until 30 June (extended to 31 December). Elimination of waiting period for unemployment benefits. Special guidelines to municipalities granting supplementary and preventive social assistance (prioritization of cases totally without other incomes, granting preventive social assistance if there are delays granting basic social assistance in Kela/Social Insurance Institution), municipalities are not recommended to apply reductions of social assistance due to non-compliance (e.g. person refuses to accept a work offer or does not participate in training or certain other activating or integration measures). Temporary increase in disregard for adjusted unemployment benefits payable between 1.6. 2020 and 31.10.2020. For benefits payable for this period the disregard is EUR 500 per month (normally EUR 300 per month).  The adjusted (reduced) unemployment benefit may be paid to unemployed persons working e.g. part-time or reduced hours. The condition of mobility allowance where relaxed for the same period (1.6.-31.10.2020).  The required period of employment for wage-earners will be shortened. Fulfilling the required period of employment is a prerequisite for receiving unemployment allowance. The required period of employment will be 13 calendar weeks instead of the present 26 calendar weeks. For non-owner family members of entrepreneurs the required period of employment will be 26 calendar weeks instead of the present 52 calendar weeks. Unemployment allowances paid on the grounds of layoffs will not be taken into account in calculating the maximum period of payment that applies to the unemployment allowance. This amendment will improve unemployment security should the unemployment be prolonged. The Acts entered into force on 15 April 2020 and will remain in force until 6 July 2020. The amendments will be applied retroactively, starting on 16 March 2020. 	Temporary lay-off procedures (STW) have been fastened to avoid bankruptcies (i.e. the notice period will be shortened from 14 to five days).	Loan guarantees for firms (4% of GDP), most notably via Finnvera, the state’s financing and export credit company. Increase of grants (0.1% of GDP): the public funding agency Business Finland's grant authorisations will be increased to permit immediate business support measures.  The government’s additional budget gives ELY Centres (Centres for Economic Development, Transport and the Environment) €400 million in additional resources for funding businesses. The funding is distributed in the form of development assistance.  	Starting from 1 April 2020, employers have the right to lay off an employee in a fixed-term employment relationship under the same conditions as an employee with an employment contract of unspecified duration. This amendment is intended to be in force for three months, or until 30 June 2020.		https://valtioneuvosto.fi/en/information-on-coronavirus
FRA		June 24, 2020		46.656	2.543	France	Strict confinement measures taken including fines for not complying, only essential shop will remain open. Need a Attestation de déplacement dérogatoire to leave the house or else a fine can be given. Confinement measures expected to be progressively lifted by areas from 11 May, upon  local sanitary conditions	Teleworking encouraged when possible	Waiving of the 3-day waiting period for private-sector employees and self-employed workers to receive sickness benefits/daily allowances (paid by health insurance): are now paid from the 1st day of illness (for reasons related to COVID-19 but also for any other sickness) for all sick leave in all regimes. In addition, for employees: waiving of the 7-day waiting period to receive the supplementary employer allowance for sickness absence related to COVID-19. Applies until 10 July 2020 (end of the state of health emergency).  Coverage of paid sick-leave (without firm cost-sharing) of workers who will have to stay home to take care of their children.  COVID-19 will be systematically and automatically recognised as an occupational disease for all health and care workers (including self-employed carers). This implies full coverage of medical care, increased daily allowances, and increased protections associated with this type of risk.	There are two different systems for employees (insured under the general regime of social security) who received health instructions to self-isolate (as of 1st of May – before this date sickness benefits applied to all cases of quarantine): 1. Paid sick leave and sickness benefits (PSLSB): for employees who have been in close contact with someone who has COVID-19. The persons concerned receive sickness benefits (daily allowances) paid by the health insurance and paid sick leave (supplementary compensation) by the employer.  2. Short-time working benefits (STW): for employees in the private sector who are required to self-isolate because they (1) have an elevated health risk (e.g. pregnant women in their third trimester of pregnancy or people suffering from a long-term condition, chronic diseases patients); or (2) live with another vulnerable person. The standard STW conditions apply. No waiting period for both.	Before 1 May 2020, working parents (employees and the self-employed) with children under age 16 affected by school closure and/or self-isolation were entitled to paid sick leave (paid at 90% of gross earnings for the first 30 days) if no alternative care or work (e.g. teleworking) arrangements could be found. From 1 May 2020, for parent employees, a similar arrangement applies but the parent is placed on the short-time work scheme (see right). Payment under the new scheme equals 70% of gross salary (about 84% of the net salary), and 100% for employees on the minimum wage. Self-employed parents continue to have a right to paid sick leave under the previous scheme. Paid by public social insurance.  Some schools and childcare facilities remain open, with a skeleton staff, to look after children of essential service workers.	Creation of a solidarity fund for small companies. Coverage of very small businesses (turnover < €1M), self-employed workers and micro entrepreneurs experiencing a very sharp drop in turnover (70% loss between March 2020 and March 2019) or subject to administrative closure. Unemployed people will continue receiving their benefits and the confinement period will not be counted in the calculations of unemployment benefit rights (including for the so-called intermittents du spectacle).Temporary agency workers will be paid for the entire duration of their assignment as initially foreseen even if they cannot work because of the confinement measures. People who quit a job for another one but could not be hired for the crisis are granted exceptional access to the unemployment insurance. Craftsmen and retail traders will get a one-off tax-free payment of max 1250 euros (financed by drawing on the supplementary pension scheme for these self-employed workers thanks to an agreement with the employers' association).	Extension of short-time work schemes (including domestic work) through higher coverage of workers’ payments (100% at the minimum wage and 84% of higher gross wages  up to a maximum of 4.5 SMIC) and the absence of cost sharing for firms and granting companies a period of thirty days to file their request, with retroactive effect; solidarity fund will cover up to 80% of their net income. Some derogations to maximum working hours to allow essential services to work more hours if need be. Companies may also impose annual leave to all employees.	Postponements of social security contributions and corporate/personal income tax payments for firms and entrepreneurs, and, on a case-by-case basis, exemptions from these payments. Up to EUR 300 billion of public guarantees (12.4% of GDP) for business loans	Economic dismissals will be subjected to increased scrutiny.	Extension of the seasonal suspension of evictions from dwellings until the end of July (la trêve hivernale).  The government has requisitioned hotel rooms for homeless people to be used for confinement.   Extension of emergency housing spaces that are made available during the winter period; in addition, 7,000 beds previously available only in the winter will be made available all year long.  Postponement of planned reform to the housing subsidy (APL), which was set to be implemented on 1 April 2020. 	https://www.gouvernement.fr/info-coronavirus https://www.cohesion-territoires.gouv.fr/en/node/44540
DEU		June 24, 2020		51.394	9.657	Germany	Schools and universities were physically closed, travel was restricted, non-essential shops and public spaces were closed and large gatherings were banned. Deconfinement: Initially, smaller stores below 800 m2, car dealerships and book and bicycle shops were allowed to re-open from the week of 20 April. Schools have gradually started to open from 4 May, while most teaching at universities continues to be digitally-based. All shops, restaurants and hotels are now allowed to be open, under strict guidelines to hygiene and physical distancing. Large public gatherings remain banned until 31 August.	Teleworking has been encouraged when possible	Application of the Protection against Infection Act (IfSG), in place prior to the crisis but only applying in such crisis circumstances due to a virus. For the first six weeks of sick leave, the amount provided as sick leave corresponds to the net salary, after which the amount equals to sick leave benefits. Also applies to self-employed workers. As of 09/03, temporary easing of requirements for the provision of a doctor’s certificate: people with symptoms of COVID-19 may call their doctor to get a telephone-based or online medical assessment instead of a visit and go into sick leave afterwards for a maximum of 7 days.	The Infection Protection Act ensures that quarantined employees who cannot work from home will continue to receive a salary and employers will be reimbursed by the government (the health ministry). The self-employed also have the right to an income replacement from the health ministry if there is a concrete and certified suspicion of infection.	Working parents with children under age 12 who have not been able to work due to school or child care closures have been entitled to six weeks of paid leave, paid at 67% of earnings up to the ceiling of EUR 2016 per month. The leave is paid by the employer who then claims compensation from the relevant state authority. In addition, the government has simplified the application process for the child supplement, a means-tested in-work benefit. During the confinement phase, some schools and childcare facilities remained open, with a skeleton staff, to look after children of essential service workers.	Self-employed persons and freelancers will receive compensation for loss of earnings based on the profits established in the tax declaration of the previous calendar year. The ruling coalition agreed to extend the maximum unemployment benefit duration by three months for all claimants whose entitlements end between 1 Mai and 31 December.	Previously, companies could apply for Kurzarbeit when 30% of their employees were affected by a drop in orders due to economic developments. This has now been lowered to 10% of employees. There has been a partial or complete waiver of the need to build up a negative balance in working hours. Reduced hours compensation benefit will also be available to temporary/agency workers. Social security contributions are completely reimbursed by the Federal Labour Office. On 22 April, the government announced to increase replacement rates for lost earnings in the short-time work scheme. Payments will increase from 60% to 70% for childless workers and from 67% to 77% for workers with children from the fourth month of short-time work onwards if they have reduced their working time by at least 50%. In the seventh month, payments are increased further to 80% and 87% respectively.	Germany has protected businesses with liquidity measures, authorising the state-owned bank KfW to lend out €610 billion to companies to cushion the effects of the coronavirus. To support the recovery of restaurants, the reduced VAT rate of 5% will be applied to this sector for 12 months starting on 1 July. The economic stimulus package from 12 June includes a comprehensive support program for small and medium-sized companies that are particularly badly affected by the corona crisis. 		As of 1 April, missed rent payments due to COVID-related reasons cannot lead to evictions and rent payments for these tenants will be postponed (in force until 30 June). Rents need to be paid in full afterwards (by 30 June 2022) to ensure no losses for landlords. Consumers that cannot finance running consumption costs for their housing units (such as electricity, gas, telecommunication or water) can postpone them without being charged late payment fees or forced to judicial debt collection.	https://www.bmas.de/DE/Schwerpunkte/Informationen-Corona/Fragen-und-Antworten/Fragen-und-Antworten-corona/corona-virus-arbeitsrechtliche-auswirkungen.html https://www.bundesfinanzministerium.de/Content/DE/Standardartikel/Themen/Schlaglichter/Konjunkturpaket/2020-06-03-konjunkturpaket-beschlossen.html 
GRC		June 8, 2020		39.787	21.617	Greece	Strict confinement measures introduced shortly after the first COVID-19 cases in Greece: schools and universities closed, travel restrictions, non-essential shops, cafes and restaurants (except for take-away)  and public spaces  closed, churches closed to the public, ban on  gatherings. Confinement measures have been gradually lifted. Tourim expected to restart in June/early July. 	Teleworking encouraged when possible during confinement. Employers were encouraged to re-organise the working time to protect the health of employees, cancel travel abroad, cancel workshops, seminars, etc. Minimise gatehrings by e.g. holding essential meetings via videoconference. 			Measure during confinement and school closure: Working parents who are not able to work due to child care facility closures are entitled to 15 days paid special family leave. For every four days leave granted, one day must be taken from the employee's annual leave entitlement. The other three-in-four days are paid by a combination of the employer and the state. Applies only to families where both parents are in paid work. Only one parent may apply. Until the end of the school year: In agreement with their employer, working parents of school-age children can reduce their working hours up to 25% until the end of the school year while maintaining their wage. They have to agree with their employer to work theseextra  hours/days in different moments during the year.	800 euros payment (to be made in the first half of April) to about 500 000 employees in companies/businesses whose operation has been suspended because of COVID (Government decision) and payment of their social security contributions. This also applies to self-employed.  Unemployment benefit payments will be extended by 2 months for those whose entitlement ends in first quarter 2020. Payment of 800 euros to those who lost their jobs between 1/3/2020 and  20/3/2020, if they do not receive UB. LTU will receive exceptional income support of 400 euros (these concerns 168 000 persons who became LTU between1/4/2019 and 16/04/2020). Special provisions for the tourism sector (extension of seasonal unemployment benefit, special compensation of 534 euros (from 1/6-30/9/2020) for seasonal workers in the tourism sector whose contract has been suspended).	STW scheme for the period 15/6-15/10 ("syn-ergasia"). Eligible employers are those who have experience at least 20% revenue loss in the month(s) prior to participation. Employers can reduce the working time of one or more of their full-time employees by up to 50% of normal working hours. The state subsidises 60% of net wages. Social contributions are paid exclusively by the employer. In case of low-paid workers, the state tops up the payment to ensure the minimum wage is paid. Employers engage to maintain the labour contract and nominal wages. More generous conditions apply for the aviation industry	Social contributions payments and tax obligations due in March have been postponed by 4 months for the affected companies/businesses (had to suspend their operation). The suspension of social security and tax obligations are conditional on no layoffs. Suspension of bank loan repayments for consistent enterprises. Companies whose operation has been suspended because of  COVID will pay only 60% of their rent in March and April.  	Layoffs were prohibited in companies/businesses whose operation was suspended with Government decision during the confinement  or those benefiting from a number of Covid-related provisions when the confinement restructions were lifted. 	Temporary reduction of rent payments (to 60%) for their main residence if tenants lost their job. Mortgage payment can be postponed by 3 months (April, May, June, possible to be extended by two months) for the beneficiaries of the 800euros payment and companies/businesses affected by COVID-19.	https://www.minfin.gr/web/guest/deltia-typou/-/asset_publisher/4kjvD0lBldee/content/d-t-topothetese-tou-ypourgou-oikonomikon-k-chrestou-staikoura-gia-te-deutere-desme-metron-antimetopises-ton-epiptoseon-tou-koronoiou?      https://www.ypakp.gr/uploads/files/3501.pdf
HUN		June 24, 2020		47.174	19.618	Hungary	• Schools and universities are closed (virtual education is in place).                                          • Ban on gatherings above 100 individuals inside and 500 outside.                                                  • Non-essential shops can be open only until 3pm.  • Movements asked to be limited to essentials and while keeping 1.5m from others.                                    • Those above 65 can only go to supermarkets and pharmacies only between 9 and 12 o’clock (while persons under 65 outside this period).                                           •Visiting residential social institutions is prohibited.  • Travel bans are in place.	The employer has the right to modify working time diverging from what is mandated in the law, order telework unilaterally and put in place measures to protect the health of the employees. 		Employees under compulsory quarantine are entitled to state-run sickness benefits. They receive 60% of their average wage paid by the State or 50% when the time of being insured is shorter than 730 days or the person entitled is staying in hospital. This does not apply if quarantine is ordered by the employer or voluntary. Also applies to the self-employed.	Some parental benefits (GYES, GYED, GYET) that would expire during the state of emergency will be extended until the end of the state of emergency. 	A self-employed worker who has to reduce its production & working hours but still has its operation ongoing can apply for an income compensation in the framework of the short time work scheme but only in case of applying for the grant with his or her employee(s). If the self-employed has to cease its operation due to the pandemic, s/he is eligible for jobseekers’ allowance.	• Short-time work scheme, where the state pays 70% of the wages lost due to the reduced working hours for 3 months for employees whose working time has been reduced by 15-75%.  • The state provides 40% wage compensation (maximum 1000 euro) for engineers and those working in the R&D sector for a period of three months. Workers who benefit from this cannot be eligible for the short-time work scheme. 	• Stop/break in corporate loan payments until December 2020. • Short term company loans get automatically elongated until June 30. • Employers in tourism and hospitality, entertainment movie making and performing arts, gambling, event management, media those providing sport services are exempt from paying social security contributions after their employees between March and June.  • ‘Small taxpayer’ Enterprises (Kisadózó vállalkozások) working in personal transport industry (taxis etc.) have some corporate tax exemptions. Further temporary tax exemptions is granted for 81,480 small businesses and individual entrepreneurs in selected professions until 30 June.  • Tax collection of unpaid flat-rate small business tax (so-called KATA) incurred before 1 March is suspended until the quarter following the end of the state of emergency.    • The tourism and hospitality industry is exempt form tourist tax until the end of the year.                                                                             • Funds of 600 million HUF available for ’protection’ of the tourism industry.                                                                      • Loans of 2000 billion HUF available with preferential conditions for businesses.                                              • Social security contributions are decreased by 2pp.       • Processing VAT clawbacks is reduced to 20 and 30 days.		• Temporary suspension of evictions.                          • Stop/break in individual loan payments until December 2020.	https://magyarkozlony.hu/   http://abouthungary.hu/news-in-brief/regulations-related-to-taxation-released/
