ISO3	src	update	xls_saved	lat	lng	Country	Confinement__Confinement-measures	Social-Measures__Reducing-workers-exposure-to-Covid-19-in-the-workplace	Social-Measures__Income-support-to-sick-workers-and-their-families	Social-Measures__Income-support-to-quarantined-workers-who-cannot-work-from-home	Social-Measures__Helping-dealing-with-unforeseen-care-needs	Social-Measures__Income-support-to-persons-losing-their-jobs-or-self-employment-income	Social-Measures__Helping-firms-to-adjust-working-time-and-preserve-jobs	Social-Measures__Financial-support-to-firms-affected-by-a-drop-in-demand	Social-Measures__Changes-to-dismissal-regulation	Social-Measures__Helping-economically-insecure-workers-stay-in-their-homes	More__Government-links-for-more-details
LTU		June 24, 2020		55.342	24.23	Lithuania	School closures, travel bans, limited social activities encouraged, only essential shops remain open	Employers have to assess the risks faced by their employees and visitors and implement measures to mitigate those risks, paying particular attention to vulnerable staff;  inform their employees about their proposed measures; apply flexible working (teleworking) where possible.	If health care professionals, officials or other employees are infected with the illness for which the emergency is declared, they are offered a maximum sickness benefit of 100 percent from net pay. Law on Sickness and Maternity Social Insurance (Art. 11-1) stipulates that a person who, during an emergency situation or quarantine announced by the gov't, has performed professional activities which are related with direct contact with individual who has dangerous contagious illness (such as COVID-19) and for which the gov't has declared an emergency situation or quarantine - will be paid a higher amount of sickness benefit than 'standard' sickness benefit. This benefit is paid from the State Social Insurance Fund (SODRA) and is equal to 77.58% of the amount of the beneficiary's compensatory earnings.Eligibility to this higher sickness benefit should be determined on an individual basis upon submission by the employer of documents substantiating the causal link between the performance of professional activities and illness.   If a worker suffers from a serious chronic illness listed on a list approved by the Minister of Health and has no access to remote work or idle time, he or she would be able to receive sickness benefit during an emergency. The benefit will be 62.02 percent of the gross salary.	During the COVID-19 crisis, extension of sickness benefits with same compensation as usual to support workers in quarantine if they are not able to telework and are not on idle time and in situations where: - They have returned from abroad or have been in contact with someone infected with COVID-19 and must therefore self-isolate for 14 days and are not able to work. - They belong to a risk group (e.g. suffers from a serious chronic illness) and would be at risk of becoming infected if they were physically at work, and are therefore not able to work (= quasi-quarantined workers). Sick leave and sickness benefit will be issued for up to 60 days, but no longer than the end of quarantine or emergency, paid by the Sodra. 	Parents with children up to age who are not able to work due to school or child care facility closures, as well as other workers who provide care for disabled or elderly people, are entitled to up to 60 days paid leave until the end of the emergency. Paid at 65.94% of gross earnings.  Working grandparents are also included in childcare so that they can receive sick pay and sickness benefits for the care of a child in good health (enrolled at kindergarten, pre-school or elementary school) or a disabled person under 21 years old who is attending an educational institution.	Self-employed persons who have paid social security contributions for at least 3 months during the last year prior to the declaration of emergency will be paid a lump sum from the Guarantee Fund. The monthly benefit will amount to the minimum consumption requirement for the current year, which is € 257 per month. The benefit will be available through the Employment Service but will not be paid to self-employed persons who work under an employment contract.  Unemployed registered with the VET program receive training will keep receiving a scholarship of € 236, even though the education process itself is temporarily inaccessible or is carried out remotely.	When the Government declares an emergency and quarantine which prevents the employer from providing the contracted work to the employees, the employer has the right to declare downtime or partial downtime. During downtime, employees may not be required to perform work functions and are paid at least the minimum wage, but only if the employment contract stipulates a full working time rate. Subsidies‘ amounts:  • 90 percent. from the employee's accrued salary, but not more than 607 euros gross.  • 70 percent. from the employee's accrued salary, but not more than EUR 910.5 gross.  Employers who have benefited from the subsidies will also have to keep at least 50 percent jobs for at least 3 months from the end of the payment of the subsidies.	An economic stimulus plan (EUR 2.5 billion) to mitigate the effects of the coronavirus. Measures include postponement of the payments date of tax arrears for the affected taxpayers and subsidies to preserve jobs.	An employer is allowed to suspend an employee in an emergency or quarantine if the employee's medical condition endangers his or her colleagues, but the employee does not agree to work remotely. Suspension from work would be of limited duration, with no pay for this period. This is relevant when workers return from states covered by coronavirus but still go to work and disregard recommendations for isolation during the incubation period. As it is known, persons returning from any foreign country are obliged to self-isolate for 14 days.		http://lrv.lt/en/relevant-information/coronavirus-in-lithuania/relevant-information-1/covid-19-hotline-and-contacts-for-residents
LUX		June 24, 2020		49.671	6.113	Luxembourg	School closures, travel bans, limited social activities encouraged, only essential shops remain open. Movement on public roads by individuals is prohibited, except for a specified set of activities.	Employees are encouraged to work from home. The option of closing border has not been considered as Luxembourg heavily relies on the daily commuters and around 70% of medical staff are non-residents. Stricter rules for parents applying for special leave to look after their children during the lockdown period aimed at limiting the spread of Covid-19.		Workers in mandatory quarantine issued by doctor from the Health Department or the Health Inspectorate are eligible to sickness benefit with the same waiting period, level and duration as someone who is sick. In this case, the days of quarantine are covered by Social Security.  Moreover, there is no accidental or involuntary technical unemployment scheme applicable in the event of a risk of epidemic. For the other employees constrained by mandatory quarantine measures and who cannot telework, the employer would have no choice but to grant extraordinary leave to the employee(s) with continued pay without counting a single day of ordinary leave (possibility of request for STW).	Working parents with children under age 13, who have no other possible option for child care, are entitled to take special paid leave for as long as schools are schools and child care facilities are closed. Parents taking leave receive continued payment of salaries by the employer, who are reimbursed by public social insurance. Parents are permitted to alternate their special leave. Self-employed workers can take family leave if affiliated to the Mutualité des Employeurs, the employers' mutual insurance scheme, as a self-employed person. In the context of the measures adopted by the Government to contain the spread of the coronavirus, a specific form has been drawn up for those parents who have to look after their child(ren) under 13 years old, so that they will be able to benefit from leave for family reasons.  Leave for family reasons may be taken by a parent of such a child if no other childcare options are available.  If necessary, parents may alternate taking leave for family reasons. If so, each parent must send in a separate form.	Automatic extension of unemployment benefits lapsing during state of crisis.	Expansion of short-time working scheme ("chômage partiel") to all companies affected by effects of the current crisis, with 80% of employee's salary being reimbursed through the Fonds pour l'emploi, floored at minimum wage and up to a level of 250% of minimum wage. (estimated impact: €500m per month) Simplified, online procedures in place for companies requesting "chômage partiel".	Companies can request cancellation of Q1 and Q2 2020 corporate tax advance payments and may ask for the deferral of payments due after 29 February, without late payment penalties. Deadline for filing corporate and personal income tax returns is extended to 30 June 2020. Outstanding VAT credits below €10,000 have automatically been reimbursed during the week of 16 March. Penalties for the late submission of VAT and other declarations are waived. Additional flexibility starting 1 April by the Centre commun de la sécurité sociale for companies' payments of social contributions, notably through a temporary suspension of late payment fees and of forced recoveries.  Companies with less than 10 employees, forced to cease their activities under the "state of crisis", to receive tax-free lump-sum grants of up to €5000 (estimated impact: €50m). New aid scheme introduced to support SMEs, providing repayable advances of up to €500 000 (estimated impact: €300m). Temporary suspension of refunds for cancelled package holidays in support of travel agents.  The smallest companies and freelancers would be eligible for a new €5,000 grant that does not have to repaid and will not be taxable. The grant is meant for firms like hairdressers and restaurants that were forced to close their doors on 18 March  Additional loans and guarantees.		Extension of the seasonal suspension of evictions from dwellings (la trêve hivernale). Lowering of eligibility criteria and increase of financial support under means-tested housing subsidies for rent and ownership.	https://msan.gouvernement.lu/en/dossiers/2020/corona-virus.html https://meco.gouvernement.lu/dam-assets/dossiers/TableauProgrammeStabilisation.pdf
MEX		June 24, 2020		22.925	-101.68	Mexico	On 30 March, the Ministry of Health declared a national sanitary emergency. All non essential activities are suspended until April 30. The entire population residing in Mexican territory is encouraged to voluntarily remain home, while the confinement is mandatory for anyone over 60 years of age, pregnant women, or people with chronic or autoimmune diseases. Even in sectors deemed essential (such as healthcare and law enforcement), meetings of more than 50 people cannot be held and basic hygiene, prevention and healthy distance measures should always be applied.  On may 13, the government announced today its reopening plan, which in three stages. 	Only essential activities are allowed. Teleworking encouraged when possible. People aged 60 and above, pregnant women and people with chronic or autoimmune diseases are dispensed from going to work. Firms have to: (i) provide sanitary products and personal protective equipment to working people; (ii) organize schedules for the use of facilities in order to decrease the contact; (iii) separate shared workstations at a distance of 1.50 to 2 meters. More generally, the Ministry of Labor and Social Security (STPS) launched the "Together for Work" ("Juntos por el Trabajo") initiative to share with workers, employers and the general public a set of tools, guidelines, training courses and practical advices about the changes in the labour market due to Covid-19.	Usually, a worker (formal sector) covered by social security who cannot work due to sickness can access to paid sick leave from the Mexican Social Security Institute (IMSS), with a compensation of  60% of the wage registered by the employer for up to 78 weeks.  According to an amendment of the LFT made in 2009, when a sanitary contingency is emitted by the authorities, the employer must pay workers the monthly minimum wage (3,966 pesos = 150 euros), with maximum duration of 1 month (article 42 bis). This applies in the current COVID-19 outbreak context.  Previously, the sickness benefit had a 3-day waiting period and level of 915.78 pesos.  During the COVID-19 outbreak, the Mexican Social Security Institute (IMSS) is issuing paid sick leaves online.					Some States are taking different actions to support SMEs in the formal and informal sectors, including discounts on payroll taxes for SME's and credit lines for payment of payrolls or supply merchandise for SMEs. The Federal Government, through the development bank Nacional Financiera (Nafin), will support SMEs up to MXN 36.3 billion (USD 1 billion). Out of one million credit products of MXN 25 000 each (USD 1 000); 500 000 of them will be provided to the formal economy and 500 000 loans will be extended to the informal economy. The loans will be settled over a period of 3 years, with no payment in the first three months and further monthly payments of MXN 1 000 (USD 42), at an average rate of 6.5% per year. The Government will further boost the economy by providing new financing of at least MXN 24.8 billion via other development banks.	The Ministry of Labor and Social Security (STPS) stressed that there is no legal basis to separate workers or unilaterally modify working conditions due to Covid-19. As such, the Federal Attorney for Labor Defense (PROFEDET) opened a website to foster social dialogue, so that workers and employers can reach beneficial agreements for both parties (https://procuraduriadigital.stps.gob.mx/). The website also provides legal advice to affected workers.	Starting from 15 April, the National Institute for Workers' Housing (INFONAVIT) covers up to 3 months of credit payments for workers who become unemployed. This extension will continue up to 6 months without additional charges.	https://coronavirus.gob.mx/  http://juntosporeltrabajo.stps.gob.mx/
NLD		June 24, 2020		52.426	5.721	Netherlands	Schools, kindergartens, restaurants, cafés and universities are closed. As of 23 March all gatherings are banned. Additional measures to keep social distance in shops. Ban on "contact professions" related to personal care such as barbers and beauticians. Borders are closed for “unnecessary travel” for 30 days starting 18 March. As from 11 may Dutch childcare facilities will be open as per normal, and primary school kids (4-12) will be in school half-time. As from June 2, Secondary schools will re-open as well (probably on a part-time basis).	Employees are encouraged to work from home		An employee placed in mandatory quarantine is entitled to sick pay (same rules apply as in the case of a sick worker). If the employee is not able to work from home, then an employer may apply on behalf of the employee for sickness benefits instead.	Some schools and childcare facilities remain open, with a skeleton staff, to look after children of essential service workers. These services are provided free of charge for families in which at least 1 parent performs essential services (education, healthcare, childcare, food sector, key transport, key public sector).  Parents who are not in essential jobs and who cannot organize the care or schooling for their children due to the school closures and who are not able to work from home are entitled to emergency leave or short-term care leave. The same applies for workers who have to take care of relatives because they are sick or have been admitted to a hospital or summoned to quarantine. - The emergency leave is meant for short leave due to immediate private emergencies, because of unforeseen and special circumstances (with full pay), paid by the employer. - The short-team care leave is available for a short period and its duration depends on the circumstances (with a maximum of two times the weekly working hours during twelve months). The employee can remain entitled to 70 percent of the normal salary, but additional rules can apply (e.g. pursuant to an employee handbook and/or collective labour agreements). If an employee wants/must stay at home longer than is permitted by law, the employer and employee will have to make agreements about this, including e.g. change the working time schedule or taking unpaid leave or holiday days. 	Complementary income support for self-employed persons up to social assistance benefit level for three months. No asset or partner income test. Support can also be provided in the form of a working capital loan at a reduced interest rate.	The reduced working time scheme (making use of the unemployment benefit scheme) has been reformed into a temporary labour cost compensation scheme, called Tijdelijke Noodmaatregel Overbrugging ten behoeve van behoud van Werkgelegenheid (NOW). An employer expecting a turnover loss of at least 20% can apply for a salary contribution subsidy of maximum 90% of the wage bill for three months (depending on the turnover loss), as long as no staff is made redundant for economic reasons and their wages are not cut during the subsidy period. 	Tax holiday for affected businesses (concerning corporate income tax, value added tax and payroll tax). Temporary bridging loans for small and medium-sized enterprises. One-off €4,000 compensation for entrepreneurs in specific sectors (restaurants, "contact professions", retail sector).		The Dutch government has moved to stop eviction during the COVID-19 period, and is preparing legislation to extend time-limited rental contracts (at present at expiration the tenants either have to leave or be offered a contract of unlimited duration). Until 1 July 2020, banks or other financial institutions will not be able to force sales of homes whose owners cannot meet their mortgage payments.	https://www.government.nl/topics/coronavirus-covid-19
NZL		June 24, 2020		-42.558	172.377	New Zealand	Confinement meausures to be lifted at midnight on 27 April. Then another 2 weeks at level 3 planned. May 11 could see move down to level 2. Important industries like construction, manufacturing and forestry will be able to open, as will retail so long as it is contactless retail	Employees are encouraged to work from home	Private-sector employees who are sick (whether or not due to COVID-19) first have to find a solution with the employer. The employer can apply for support: 1. Solution with employer: use existing paid sick leave entitlements, and if not available paid special leave should be considered.  2. Subsidy for the employer: An employer can apply for the COVID-19 Leave Payment Scheme to pay their employees in situations where employees need to stay away from work due to COVID-19 related reasons (incl. sick) and cannot work from home. If the employer receives this, s/he must make best endeavours to pay the employee at least 80% of their usual salaries or wages. If that isn’t possible, the employer must pay at least the subsidy rate of the Leave Support Scheme (i.e lump-sum of $585.50 per worker per week for full-time workers and $350 per worker per week for part-time workers), which covers 4 weeks per employee. All businesses and organisations (except the state) are eligible for this support.	The COVID-19 Leave Support scheme applies in the following cases of quarantine provided individual cannot work from home: (1) sick with COVID-19 until cleared by a health professional; (2) have been in contact with someone who has COVID-19 and must self-isolate for 14 days; (3) who should be self-isolating because they are considered to be at high risk (or are living with who is considered to be at high risk), or; (4) who should be self-isolating because they have to take care of a dependant or for someone who is sick with the virus. 	Essential service workers with children aged 5 to 14 who are working outside the home are entitled to funding for in-home childcare services.   Workers who are unable to work because they are caring for a dependent who is sick or self-isolating are entitled to paid leave under the "COVID-19 Leave Support Scheme". Paid by the state through the employer at NZD 585.80 per week for a full-time employee. Employers are encouraged to top-up payments to at least 80% of earnings. Available for employees and the self-employed.	Anyone who loses their regular income due to self-isolation will still receive a payment, whether they work for a big or small company, in one sector or another, or if they are self-employed.  All people legally working in New Zealand are eligible for the scheme. Wage subsidies open to sole traders and the self-employed as well as firms.	Wage subsidies vailable for all employers that are significantly impacted by COVID-19 and are struggling to retain employees as a result.	NZD 12.1 billion (4% of GDP) fiscal support to help businesses cope with the economic effects of the pandemic (it includes wage subsidies). Government announced a further set of tax proposals to help businesses manage the impacts of COVID-19. These include: - greater flexibility for taxpayers in respect to tax deadlines - changes to the tax loss continuity rules - a tax loss carry-back scheme.  		Temporary (six-month) freeze of rent increases; suspension of evictions from rental properties (except if both parties agree and/or in limited circumstances)  NZD 100 million package to provide temporary shelter to the homeless in motels.	https://www.govt.nz/covid-19-novel-coronavirus/ https://www.rnz.co.nz/news/national/413291/christchurch-city-council-allows-rate-payment-deferrals
NOR		June 24, 2020		61.155	9.77	Norway	Shut down of schools and universities, cultural and sports events and some private-sector.		Diminution of the waiting period to receive sickness benefits for self-employed workers and freelancers: 3-day waiting period now, compared to a 15-day waiting period usually (still no waiting period for employees)  Moreover, the self-reported period for sickness from employees is now longer than usually (16 days).  Use of electronic report, telephone-based or online medical assessments. 	In the event of mandatory quarantine or self-isolation ordered by the health authorities to workers suspected to be infected with COVID-19 or who belong to a risk group, employees and self-employed workers are entitled to paid sick leave. However, they need a medical assessment (medical certificate issued without a physical exam). Same rules apply as in the case of a sick worker in terms of benefit level and duration.	Extension to the existing family care leave entitlement. For 2020, working parents with one or two children are entitled to 20 days paid family care leave (up from 10), and those with three or more children to 30 days (up from 15). Single parents have the right to 40/60 days per year in 2020. Paid at 100% of earnings. The first three days are paid by the employer, and the remainder by public social insurance. Available to both employees and the self-employed, although a 3-day waiting period applies for self-employed claimants.	Deferral of household wealth tax payment.	Targeted sectoral support is being planned, this is likely to include support for the aviation and travel sectors. Pay of wages when companies temporarily layoff workers.	Government will pay a portion of fixed costs for companies facing significant turnover decrease relating to Covid-19.  Accelerated payment of company tax rebates. 		Temporary changes to mortgage regulations	https://www.regjeringen.no/en/topics/koronavirus-covid-19/id2692388/
